id,qualifications_qualificationsummary
cv41570.xml,informática  * filosofia para crianças - colégio inei - 30 horas. o comportamento juvenil / práticas psicopedagógicas / filosofia para crianças / dinâmicas de grupo; * filosofia à maneira clássica - nova  acrópole - 60 horas. ética / sócio-política / filosofia da história / psicologia / iso - introdução a sabedoria do oriente; * técnicas de estudo - nova  acrópole - 48 horas. técnicas de memorização / mapas mentais / planos e horários / preparação para exames / leitura e reflexão; * minicurso: a importância das práticas de extensão universitária - unb 2008 - 8 horas. viii semana de extensão;  inglês: compreensão  leitura e escrita - nível intermediário cultura inglesa / yázigi / wizard   digitação / word / excel / internet  atividades desenvolvidas (durante a graduação em pedagogia - unb)
cv52404.xml,qualificação  • curso técnico em informática - 2013 local: cepa- (macapá-ap) • i simpósio de psicanálise do amapá: psicanálise  sexualidade e cultura - 2014 local: faculdade estácio seama • encontro nordestino da abordagem centrada na pessoa - 2014 local: pernambuco • apresentação na i mostra de desenvolvimento humano e envelhecimento - fama local: escola técnica graziela reis • apresentação de artigo cientifico na semana de psicologia - 2015 local: faculdade de macapá (fama) • participação do xi fórum brasileiro da abordagem centrada na pessoa - 2015 local: brasília - df •   minicurso ministrado em turmas da graduação por indicação do  coordenador do curso de psicologia - 2015 local: faculdade de macapá (fama) • participação no xii fórum brasileiro da abordagem centrada na pessoa - 2017 local: maringá/iguaraçu - paraná • participação no xii fórum brasileiro da abordagem centrada na pessoa - 2017 local: maringá/iguaraçu - paraná • artigo científico apresentado no xii fórum brasileiro da abordagem centrada na pessoa • curso introdução ao coaching - carga horária: 80h - 2017 - abeline • curso distúrbios de aprendizagem - carga horária: 60h - 2017 - abeline
cv44204.xml,conhecimentos • erwin • uml • técnicas de pmo / pmbok • tfs (team foundation server) • wcf • mvp • clear case • mvc • ms project • inglês intermediário • access • vba  • visual basic • asp • javascript • vbscript • html • com+ • iis • sql server • oracle • crystal reports • c# • vb.net • asp.net
cv47675.xml,principais habilidades e competências  •  intimidade com grande número de projetos de software livre •  profundo conhecimento da plataforma de desenvolvimento gnu •  vivência com distribuições linux debian/ubuntu/mint  redhat/centos e slackware •  experiência na criação de sistemas embarcados e diskless usando buildroot e lfs •  proficiência na operação de sistemas linux e bsd via interface textual •  experiência com hardware bay trail e cherry trail utilizando linux •  experiência com os toolkits gráficos gtk  gtkmm e qt •  experiência com programação concorrente (threads) e distribuída (soap/rpc) •  experiência com desenvolvimento de código multiplataforma •  familiaridade com diagramas e/r e uml •  domínio de web services em linguagem c utilizando a biblioteca gsoap •  familiaridade com virtualização usando kvm/qemu •  experiência na implementação de infraestrutura em nuvem com ovirt •  experiência com todos os serviços de rede comuns (http  snmp  dhcp  dns  etc) •  familiaridade com autenticação utilizando ldap  kerberos e active directory •  experiencia em projeto  gestão e automação de infraestruturas corporativa •  experiencia com projeto de centrais de atendimento e telefonia voip •  noções de auditoria de segurança utilizando metasploit •  habilidade e interesse para pesquisa e aprendizado autodidata •  boa capacidade de organização e comunicação •  inglês instrumental avançado (leitura fluente / conversação regular)
cv42688.xml,conhecimentos linguagens de programação: visual basic 6.0 avançado  delphi avançado  cold fusion  c/ c++ intermediário  java com jsp e servlets  html  javascript  jquery  xml  php com mysql  ajax com tableless / webstandards  plataforma dot net(vb.net asp.net e c#) e cobol microfocus. conheço uml.  front-end: angular js / 2 / 4 / 5  react.js  ajax  javascript  jquery / angular 4/typescript/css/bootsstrap/json/git  frameworks php: zend framework  laravel  slim  simphony  codeigniter  cake php  moodle  magento  wordpress  drupal  banco de dados: mysql 5.0  sybase 7.0  microsoft access 2000   postgresql 5.1  oracle 9i pl/sql  sql server 7.0/2000/2005/2008.  análise de sistemas / engenharia de software / modelagem de dados: conhecimentos intermediários da ferramenta case erwin 4.0 e enterprise architect 10 ; conhecimentos em metodologias ágeis scrum e xp/modelagem orientada à objetos uml /tecnologia rup / cmmi.  sistemas operacionais: msdos 6.22  windows xp/ server 2003  windows vista  windows 7.0  unix 5.0  novell  linux  conectiva e red hat.  governança de ti  / processos / projetos: bons conhecimentos em governança de ti (itil e cobit e iso 27000). bons conhecimentos em gestão de processos (bpm). microsoft project 2010  bpa e bpm(oracle) e ea - enterprise architect. mapeamento de processos e documentação estruturada. notação bpmn gestão de projetos framework - etom e tam ferramentas six sigma práticas itil  cobit e iso ferramentas de mapeamento de processos - bpms implantação de ferramenta bpm bizagi
cv48669.xml,"qualificações e atividades complementares   •  inglês - leitura intermediária  escrita básica (faculdade flamingo - inglês técnico/ instrumental). •  curso técnico - médio (2º grau) (técnico em programação  cps - ""centro paula souza"" (dezembro/2009) - concluído). •  curso de cobol cics ibm - ferramenta rdz  (unifieo-centro univers. fund. instituto de ensino para osasco (novembro/2011) - concluído). •  curso de montagem e manutenção de microcomputador (senai - serviço nacional de aprendizagem industrial (dezembro/2010) - concluído)."
cv53136.xml,qualificações   •  inglês intermediário •  espanhol básico •  conhecimento do pacote office
cv44295.xml,conhecimentos técnicos j2ee java servlets java server pages (jsp) enterprise javabeans (ejb) java persistence api (jpa) java message service (jms) java naming and directory interface (jndi) java database connectvity (jdbc) jca design patterns jsf  servidores de aplicações weblogic (oracle) websphere (ibm) wso2 a. s. (carbon plataform) jboss a. s. / wildfly  metodologias de desenvolvimento rup extreme programming (xp) scrum  integração continua maven jenkins nexus  modelagem uml e bpmn  frameworks richfaces icefaces jwl (the jsf widged library) jquery angularjs primefaces  sistemas operacionais linux windows  banco de dados mysql postgreesql oracle h2  histórico profssional  empresa: cds/ntc (núcleo de tecnologia em conhecimento em informática ltda) cargo: analista middleware sênior/arquiteto middleware período de atividade: 13/12/2011 até o momento atividades desenvolvidas: analise  criação  e validação da documentação técnica e de negócio; criação de propostas para projetos de integrações de sistemas e arquiteturas.  desenvolvimento de soluções de middleware com oracle e wso2; desenvolvimento de soluções técnicas utilizando a plataforma wso2. desenvolvimento de software com j2ee. desenvolvimento de poc's e prospecção de projetos. apresentação dos produtos wso2 para os clientes e treinamentos para equipe técnica.  empresa: arpia tecnologia da informação cargo: analista desenvolvedor período de atividade: 28/10/2010 à 30/11/2011 atividades desenvolvidas: desenvolvimento de portlets com websphere 6.1 e sistemas java utilizando tecnologia j2ee  jsf com icefaces e/ou jsf com jwl  hibernate  oracle.  empresa: linkdata tecnologia em gestão pública cargo: analista desenvolvedor período de atividade: 04/01/2010 à 27/08/2010 atividades desenvolvidas: desenvolvimento e manutenção de sistemas utilizando tecnologia j2ee  castor  hibernate  jasperreport (ireport 3.0)  oracle 10g  sql server  postgre sql  tom cat  svn.  empresa: unimix tecnologia cargo: programador java período de atividade: 01/11/2008 - 31/12/2009 atividades desenvolvidas: desenvolvimento de sistemas utilizando tecnologia j2ee  zk framework (zkoss)  hibernate  jasperreport (ireport 3.0)  oracle 10g  oracle ucrm  oc4j  ecm (api oracle)  svn  cvs.  empresa: fóton informática cargo: programador java período de atividade: 02/01/2008 - 27/10/2008 atividades desenvolvidas: desenvolvimento de sistemas utilizando tecnologia j2ee  java server faces  richifaces  hibernate  jasperreport (ireport 2.02)  maven  jboss  tomcat  cvs.  empresa: universidade de brasília - unb cargo: analista/programador período de atividade: 01/07/2007 à 31/12/2007 atividades desenvolvidas: analise e documentação de sistemas web  nos padrões da instituição utilizando metodologias de engenharia de software; desenvolvimento de sistemas web java e php; manutenção de sistemas e sites; utilização das frameworks struts(java) e zendframework (php);  utilização das frameworks javascript/ajax dojotolkit e extjs.  empresa: ministério do meio ambiente (empresa capital) cargo: suporte técnico. período de atividade: 01/01/2006 - 31/06/2007 atividades desenvolvidas: suporte e manutenção de microcomputadores; desenvolvimento de sistemas web(smarty  propel  fusebox  php 5  javascript (dojo)  padrão mvc  paradigma oo)  framework iflux; analise de sistemas utilizando a uml. manutenção do site do bcdam/sca/mma www.bcdam.gov.br ; administrador de sistemas de informação.
cv42895.xml,•   informática (microsoft word  excel  outlook  internet explorer). •   inglês - avançado. •  curso de inglês - harvard extension school - conclusão: julho/2011. •  intercâmbio cultural - estados unido - janeiro/2011 à julho/2011. •  intercâmbio profissional - estados unidos - setembro/2017 à outubro/2017. •   aplicação e correção de avaliação psicológica (palográfico  quati  zulliger  g36  r1  d2  ac  tadim  tacom  bpr-5) 
cv48772.xml,qualificações  ●  especializado em t.i. - foco em sistemas web. ●  experiência em diversos projetos atuando como arquiteto de soluções  analista de sistemas  desenvolvedor e líder de equipe. ●  desenho e modelagem de soluções e padronizações. ●  levantamentos (análises  especificação de requisitos (funcionais e não funcionais)  especificações técnicas  escopo  mensuração e prazos). ●  uml (requisitos  fluxos de atividade  casos de uso  diagramas de classe  sequência). ●  mapeamentos objeto-relacional. ●  modelagem em bancos de dados relacionais / mer (ddl e dml) e não-relacionais (nosql). ●  modelagem orientada a objetos. ●  planos de teste  casos de teste. ●  metodologias alm  rup  xp e kanban  agile com scrum na prática diária (continuous integration  tfs). ●  desenvolvimento / implementação / implantação/ correção. ●  integração de novas tecnologias com sistemas legados (integração de plataformas .net e sap  rfc). ●  liderança de equipe (gerenciamento de demandas  distribuições de tarefas e prazos).   conhecimentos específicos  ●  ms visual studio.net (2003  2008  2010  2012  2013  2017) ●  .net framework 1.1  2.0  3.5  4.0  4.5  5.x  6.x  core (c# e vb.net) ●  asp.net  web forms  mvc  webservices  rest  webapi ●  windows forms  windows services  windows application  wcf  wpf ●  ado.net  linq  entity framework ●  arquitetura em n camadas  soa  design patterns ●  enterprise library - ms app blocks ●  orientação a objetos (oo) / componentização ●  html  html5  javascript  css  jquery  angularjs  node.js  bootstrap  ajax  json  xml ●  sql server (6.0/2000/2005/2008/2012)  oracle (pl/sql)  postgresql  mysql  mongodb ●  ms sql server management studio  toad  pl/sql developer  pgadmin  integration services  etl. ●  crystal reports  ms reporting services  ms integration services ●  ferramentas rose  ms visio  erwin  enterprise architect (ea)  sybase powerdesigner ●  controle de versão: source safe  clear case  team foundation server (tfs)  svn  github ●  antigas experiências (vb6  asp3  vbscript  ms access  c++)   noções  ●  técnicas de análise por pontos de função. ●  aws (amazon web services) ●  java - j2ee ●  ms-project  gerência de projetos (pmbok) ●  android ●  linux ●  ms xna (games) ●  nhibernate ●  ninject ●  python ●  estudando atualmente para certificação da microsoft mcsa: aplicativos web.
cv52851.xml,"qualificações complementares inglês: leitura avançada  conversação avançada.  disciplinas relevantes: psicologia organizacional; análise organizacional; treinamento  desenvolvimento e educação; técnicas do exame psicológico; diversidade nas organizações.  conhecimento intermediário do pacote office em geral; conhecimento intermediário do programa spss.  informações adicionais 2013  (jul - jul  2014): bolsista de iniciação científica (proic) na área de psicologia do consumidor  cultura organizacional e valores pessoais com o prof.º dr.º cláudio torres.  2015  (jul - jul  2016): bolsista de iniciação científica (proic)  na área de recrutamento e seleção  avaliação psicológica e mapeamento de competências com a prof.ª dr.ª cristiane faiad.  2016  (fev - fev  2018): bolsista do ministério da educação no programa de educação tutorial em psicologia (pet-psi/ip/unb).  2018  (jul): apresentação de comunicação breve de pesquisa com o estudo ""evidências de validade da escala de liderança ética no trabalho"" sob orientação da prof.ª dr.ª juliana porto no viii congresso brasileiro de psicologia organizacional e do trabalho."
cv42154.xml,qualificações e atividades complementares   ✓ pacote office intermediário ✓ relações humanas ✓ departamento de pessoal ✓ 5s otimização de qualidade e processos ✓ auditoria interna da qualidade nbr iso  9001:2015 ✓ eneagrama na empresa
cv54906.xml,conhecimentos: • **asp.net webforms/mvc/web api  asp.net core. • **wcf  rest  api dev  api gateway. • **c#  vb.net  powerbuilder  delphi  t-sql  plsql. • **javascript  jquery  angularjs  typescript  nodejs  spa apps. • **front end frameworks  ionic  css  html5  bootstrap. • **oop  ooa  ood  mongodb  mysql  sqlserver  oracle. • **uml  design patterns  ddd  tdd  pocos  microservices architecture  soa  systems architecture. • **git  devops with vsts. • **entity framework  nhibernate. • **cloud  azzure  docker. • **administração de servidores windows.
cv45056.xml,informática  pacote office  internet e e-mail.
cv34194.xml,qualificações e atividades profissionais   •  inglês - (uns idiomas  1 ano e meio  conclusão em 2010). •  curso de photoshop. (saga  3 meses  conclusão em 2011). •  conhecimento intermediário de java+flex com eclipse e blazeds(livros e vídeo aulas). •  conhecimento intermediário de jboss seam e hibernate(livros e vídeo aulas). •  conhecimento intermediário de jsf  richfaces  primefaces. •  arquitetura de sistemas(caelum  60 horas  conclusão em 2016)  informações adicionais   •  2º colocado nas olimpíadas de programação - facnet - anhanguera (2010). •  oracle certified professional  java se 6 programmer (26/07/2013) •  oracle certified professional  java ee 5 web component developer (10/10/2013)
cv55151.xml,qualificações  capacidade liderança facilidade em redigir textos facilidade de comunicação
cv38615.xml,specialties: software development  system analysis  uml  java  eclipse ide  jboss seam  jsf  richfaces  object oriented programming  ejb  j2ee.
cv44067.xml,informática  ● amplo conhecimento em diferentes linguagens de programação  ferramentas e metodologias  banco de dados e plataformas.
cv42559.xml,informática pacote office completo design gráfico  adobe photoshop cs6 avançado e adobe illustrator cs6 avançado
cv47889.xml,conhecimentos  programação mobile- android e ionic. programação estruturada - c. programação orientado a objetos - java. programação web - java  jsf  jsp  jpa  jstl  hibernate  spring  git  rest  ejb. metodologias ágeis - scrum. servidor de aplicação- wildfly  weblogic  tomcat  glassfish. html  css  javascript  typescript. angularjs  angular2.jquery. sql intermediário. modelagem de dados. banco de dados - oracle  db2  mysql  postgres  orientdb  neo4j. linux.
cv52029.xml,informática: windows  pacote office  internet - usuário em nível avançado.   habilidades pessoais: • facilidade no trato com pessoas de todos os níveis sociais; • gosto pelo trabalho em equipe. • organização pessoal • determinação para aprendizado   à disposição para entrevistas presenciais.
cv21667.xml,specialties: xml  html  javascript  usabilidade  css  php  asp
cv55416.xml,informática  • windows 98/nt/2000 professional/me/xp/ vista - avançado • microsoft office: outlook  word  excel e powerpoint - avançado • ferramentas de internet - avançado
cv42655.xml,conhecimentos  phpoo  javascript  jquery  ajax  json  nodejs  mvc  mysql  postgresql  mongodb  pl/pgsql  api restful  laravel  codeigniter  css3  bootstrap  html5  xml  técnicas de seo  photoshop  inglês nível intermediário. noções acadêmicas ionic  java e android studio
cv43088.xml,informática fundação bradesco - agosto de 2016 excel 2010 - intermediário
cv41179.xml,áreas de atuação: psicologia clínica / organizacional / trainee   informática / erp's: pacote office intermediário.
cv42172.xml,qualificações e atividades complementares  • programming html5 whith javascript and css - (ka solution 2013) criação de paginas dinâmica em html5. criação e utilização de estilos css. manipulação de objetos em javascript  jquery e json. • framework java web spring 3 - (senac 2010) estrutura mvc com contextos de anotação nas classes que devem ser implementadas nos objetos que serão instanciados através de configurações em xml e controlados via blocos de anotação no código  atualmente essa prática é a mais utilizada no mercado. mvc: mapear o framework spring através da classe do servlet e as view(jsp) através do spring beans ambos em xml. web: mapear o acesso aos métodos no controller através de blocos de anotação no requestmapping. jdbc e orm: implementar as classes de repositório de dados e configurar o banco de dados em xml  a diferença entre eles é que no orm é implementado o o hibernat. context: implementar as classes que iram obter a instancia dos objetos que iram acessar o repositório de dados e de persistência do spring(validation bidingresult)  essa camada de persistência estou apto também a codificar em javascript e ou jquery. • struts 2 etrutura mvc com contextos de anotação ou com a implementação de classes estendendo outros objetos do struts servindo como controles  as duas formas são configuração em xml. actionsuport: implementar as classes de controle mapeando os métodos através de blocos de anotações  esse objeto faz a camada de persistência e distribuir os restantes. actionform e action: esses objetos devem ser implementados juntos  no actionform implementando a camada de persistência e no action implementando o envio da informação paro o servidor  essa camada de persistência estou apto também a codificar em javascript e ou jquery.
cv52574.xml,qualificações e atividades complementares   • prática e ensino: cuidados paliativos  casa do cuidar - sp - 07/2017 • inglês - fluente (instituição de ensino privado cna) 12/2013.
cv45459.xml,informática   •   aplicações de escritório: microsoft access  microsoft excel  microsoft outlook  microsoft powerpoint  microsoft word  open office •   sistemas operacionais: javaos  windows
cv42397.xml,áreas de atuação  desenvolvedor web/mobile
cv47841.xml,03. conhecimentos gerais  nível avançado: análise orientada a objetos (uml)  análise estruturada  análise de requisitos  apf (análise de ponto de função)  delphi  clipper  oracle pl/sql  svn  git  sourcesafe  ms-dos  windows  novell  microsoft office  quick reports  rave  faturamento  contas a pagar  contas a receber  controle de estoque  atendimento  sistema hospitalar  distribuição de publicações. nível: intermediário: asp .net mvc  razor  entity framework  html  html5  css3  bootstrap  javascript  jquery  angularjs  ajax  gerenciamento de serviços de ti (itil)  gerenciamento de projetos (pmi)  enterprise architect  visual basic  cobol  sql server transact-sql  interbase  groupwise  crystal reports  contabilidade  folha de pagamento  produção gráfica  mídia  seguros. nível básico: arquitetura orientada a serviço (soa)  gerenciamento de processos (bpm)  java  .net c#  postgres  firebird  informix.
cv54525.xml,qualificações e atividades complementares   •  inglês básico e informática básica.
cv44483.xml,● conhecimentos em informática: windows  word  powerpoint e internet. escola técnica mogiana 42 h  ● certificação de correspondentes no país modalidade transacional. instituto totum de desenvolvimento e gestão empresarial ltda  ● auxiliar de departamento pessoal - rh escola técnica mogiana 30h  ● relações humanas e empresariais. escola técnica mogiana 15 h
cv52569.xml,qualificações   formada em psicologia em 2005  tenho mais de 15 anos de experiência na área de recursos humanos; sou especialista em treinamento e desenvolvimento (lnt  desenvolver e ministrar diversos tipos de treinamentos: técnicos  operacionais  administrativos e on the job)  integração  iso 9000  5's  atendimento  vendas  elaboração de manuais  mensuração  avaliação de desempenho e testes; também me especializei em recrutamento e seleção (todos os níveis hierárquicos  operacional  administrativo  técnico  gerencial e diretoria). dinâmicas em geral  entrevistas de desligamento e aplicação de testes diversos; tenho grande conhecimento em todos os processos de forma generalista  em todos os subsistemas: admissão  rescisão  ponto  férias (sistema adp)  benefícios  cargos e salários e conhecimento de leis trabalhista e; era responsável pela inauguração de novas unidades  auditoria  verificação do clima organizacional das lojas  rh escuta  todas as pendência de rh. cuidava da formação de trainees  apoiar os gerentes de loja  treinar os treinadores nas operações e fazer os remanejamentos internos de função e área; planejamento e coordenação/gerenciamento de equipes em geral.
cv40491.xml,áreas de atuação  administrativo  sintese de qualificações  •  profissional  com  experiência  na  área administrativa  com  forte  atuação em  processos  logísticos  qualidade  padronização  e melhoria  de  processos  rotinas de  dp e  gestão  de  equipes  com  carreira ascendente em empresas nacional e multinacionais de tecnologia e telecomunicações. •  responsável pela reestruturação e padronização do batimento de inventário da matriz e filiais  realizando o controle de entrada e saída de equipamentos  garantindo a otimização e redução de custos do setor. •  desenvolvimento de  relatórios  estatísticos  de  produtividade  e  absenteísmos  dos  colaboradores e acompanhamento de sua performance. •  suporte  aos  analistas  e  líderes  do  setor  quanto  as  rotinas  do  departamento  pessoal  abrangendo  a integração de novos funcionários  tratamento do espelho de ponto  agendamento de férias  solicitação de adiantamento  entrega de benefícios e holerites. •  responsável pelo fundo fixo do setor e prestação de contas. •  atuação nos processos de qualidade por meio de monitorias  treinamento e desenvolvimento. •  gestão de equipes multidisciplinares  com forte capacidade de gestão motivacional  desenvolvimento de pessoas e cooperação entre equipe e departamentos.
cv50205.xml,conhecimentos: java (jme e jee)  sql  mysql  postgresql 8.0  sql server  javascript  css  hibernate  struts 2  servlet  jsp  jboss eap 6  apache tomcat  maven e subversion.
cv48873.xml,qualificações experiência em desenvolvimento de sistemas utilizando visual studio 2003/2005/2008/2010/2012 web(asp.net e mvc)  winforms  pocket pc  wpf  wcf  java  jsf  hibernate  jenkins  javascript  jquery  json  ajax  visual basic 5.0/6.0  java(7  8)  criação de relatórios em crystal reports 8.5 e 9.0  oracle  ms sql server 7.0/2000/2005/2008  entity framework  criação de stored procedures  trigger  function  views  access  web service (.net)  administração de servidor de telefonia (tts)  desenvolvimento de sistema para atendimento (callcenter)  integração de sistema de telefonia com visual basic 6.0 (tts e talk telecom)  controle de versão com git  tfs  rtc  microsoft source safe  svn  redes windows.
