id,schoolorinstitution_degree_comments,schoolorinstitution_degree_datesofattendance_enddate_anydate,schoolorinstitution_degree_datesofattendance_enddate_stringdate,schoolorinstitution_degree_datesofattendance_enddate_year,schoolorinstitution_degree_datesofattendance_enddate_yearmonth,schoolorinstitution_degree_datesofattendance_startdate_anydate,schoolorinstitution_degree_datesofattendance_startdate_year,schoolorinstitution_degree_datesofattendance_startdate_yearmonth,schoolorinstitution_degree_degreedate_anydate,schoolorinstitution_degree_degreedate_year,schoolorinstitution_degree_degreedate_yearmonth,schoolorinstitution_degree_degreemajor_name,schoolorinstitution_degree_degreeminor_name,schoolorinstitution_degree_degreename,schoolorinstitution_degree_userarea_degreeuserarea_graduated,schoolorinstitution_degree_userarea_degreeuserarea_id,schoolorinstitution_degree_userarea_degreeuserarea_normalizeddegreename,schoolorinstitution_degree_userarea_degreeuserarea_normalizeddegreetype,schoolorinstitution_postaladdress_countrycode,schoolorinstitution_postaladdress_municipality,schoolorinstitution_postaladdress_region,schoolorinstitution_school_schoolname
cv41718.xml,pós-graduação: faculdade estácio. desenvolvimento  orientado  a  objetos  com  java -  previsão  de  conclusão  em 12/2018,,,,2018-12,notknown,,,,,,,,pós-graduação,false,deg-1,masters,masters,,,,faculdade estácio
cv41718.xml,pós-graduação: faculdade de tecnologia senac df banco de dados e business intelligence - concluído em 10/2014,,,,2014-10,notknown,,,,,2014-10,banco de dados e business intelligence,,pós-graduação,true,deg-2,masters,masters,,,,faculdade de tecnologia senac df
cv41718.xml,bacharelado em sistemas de informação - concluído em 12/2010,,,,2010-12,notknown,,,,,2010-12,sistemas de informação,,bacharelado em sistemas de informação,true,deg-4,bachelors,bachelors,,,,
cv41718.xml,graduação: faculdade fortium,,,,,,,,,,,,,graduação,,deg-3,bachelors,bachelors,,,,faculdade fortium
cv45016.xml,centro universitário iesb curso: engenharia da computação (cursando 2° semestre - noturno),,,,,,,,,,,engenharia da computação,,,false,deg-1,,,,,,centro universitário iesb
cv44133.xml,• universidade ibirapuera ciência da computação - concluído.,,,,,,,,,,,ciência da computação,,,true,deg-1,,,,,,universidade ibirapuera
cv48180.xml,graduação em análise e desenvolvimento de sistemas ucb - universidade católica de brasília,,,,,,,,,,,desenvolvimento de sistemas,,graduação em análise e desenvolvimento de sistemas,,deg-1,bachelors,bachelors,,,,ucb - universidade católica de brasília
cv48180.xml,graduação em gestão da tecnologia da informação ucb - universidade católica de brasília,,,,,,,,,,,gestão da tecnologia da informação,,graduação em gestão da tecnologia da informação,,deg-2,bachelors,bachelors,,,,ucb - universidade católica de brasília
cv43422.xml,2002 - 2006 bacharel em sistemas de informação nível 6 qrq faculdade santa terezinha/anhanguera principais competências adquiridas: *   projeto e análise de sistemas *   modelagem de bancos de dados *   lógica e programação *   redes de computadores,,,2006,,,2002,,,2006,,nível 6 qrq,,bacharel em sistemas de informação,,deg-1,bachelors,bachelors,,,,faculdade santa terezinha/anhanguera
cv54430.xml,psicologia  universidade de brasília  7° semestre.  formação acadêmica complementar março/2018 - atualmente: grupo perfil- avaliação psicológica em segurança pública e privada  •  revisão de capítulo de livro  •  perfil profissiográfico do soldado militar do df pela ótica da polícia feminina,,current,,,,,2018-03,,,,ótica da polícia feminina,,df,false,deg-1,doctorate,doctorate,,,,universidade de brasília
cv54430.xml,janeiro/2018- atualmente: praxis consultoria em gestão de pessoas  empresa junior de psicologia da universidade de brasília  cargo de assessora de gestão de pessoas e de consultora    •  assessoria: pensar intervenções para demandas da empresa  auxiliar na       elaboração de política e eventos de reconhecimento dos membros; conduzir       entrevistas de desligamento  conduzir entrevistas de acompanhamento    •  consultoria: treinamento de feedback- ministrar treinamento de feedback.       processo seletivo aiesec- conduzir grupo focal para levantamento de perfil ;       auxiliar na elaboração da construção do roteiro de entrevista da aiesec;       conduzir entrevistas por competência  dar feedbacks aos candidatos; auxiliar na       alocação de candidatos.  janeiro/2018- atualmente: pibic: análise profissiográfica e mapeamento de competências do cargo de soldado da polícia militar do df  sob orientação da professora cristiane faiad.    •  capacitação em mapeamento de competências  profissiografia  grupo focal        design thinking; levantamento bibliográfico.    •  realização de grupo focal para mapeamento de competências e para análise       profissiográfica.,,current,,,,,2018-01,,,,orientação da professora cristiane faiad,design,df,false,deg-2,doctorate,doctorate,,,,empresa junior de psicologia da universidade de brasília
cv54430.xml,agosto/2017 a dezembro/2017: disciplina de recrutamento e seleção    •  atividade prática de elaborar um processo seletivo- doutores com riso.  março/2017 a julho/2017: disciplina tópico em psicologia social: personalidade,,,,2017-12,,,2017-08,,,2017-12,disciplina tópico,,,,deg-3,,,,,,doutores com riso
cv56582.xml,• bacharelado em psicologia - uniceub - conclusão em 12/2016,,,,2016-12,notknown,,,,,2016-12,psicologia,,bacharelado em psicologia,,deg-1,bachelors,bachelors,,,,uniceub
cv54241.xml,administração de empresas   faculdade uninter 2015 - 2019,,,2019,,,2015,,,,,administração de empresas,,,false,deg-1,,,,,,faculdade uninter
cv54241.xml,curso de gestão de pessoas   faculdade uninter 2016,,,2016,,notknown,,,,2016,,curso de gestão,,,,deg-2,,,,,,faculdade uninter
cv54241.xml,curso de ética   fgv 2015  curso de inglês   cilg,,,2015,,notknown,,,,2015,,,,,,deg-3,,,,,,fgv
cv51298.xml,graduação em administração de empresas - universidade presbiteriana mackenzie,,,,,,,,,,,administração de empresas,,graduação em administração de empresas,,deg-1,bachelors,bachelors,,,,universidade presbiteriana mackenzie
cv48450.xml,cursos curso: gestão em tecnologia da informação análise de requisitos orientada a negócio grau: graduação instituição: x25 treinamento e consultoria - mês/ano: 07/2012 instituição: unicesumar/pr,,,,2012-07,notknown,,,,,2012-07,instituição,,graduação,,deg-1,bachelors,bachelors,,,,unicesumar
cv48450.xml,instituição: uniceub / dfjug  - mês/ano: 08/2010,,,,2010-08,notknown,,,,,2010-08,,,,,deg-2,,,,,,uniceub
cv51305.xml,pece/usp - 2018 mba em tecnologia de software curso de extensão fiap - shift – maio/2018 introdução tofaf 9.2,,,2018,,notknown,,,,,,tecnologia de software,,mba,false,deg-1,mba,mba,,,,fiap
cv51305.xml,isae - fgv - 02/2016 tecnólogo em processos gerenciais,,,,2016-02,notknown,,,,,2016-02,,,,,deg-2,,,,,,isae - fgv
cv51305.xml,curso de extensão fiap - set/2010 visual studio 2008,,,,2010-09,notknown,,,,,2010-09,,,,,deg-3,,,,,,fiap
cv52099.xml,➢  palestra speed (e-social) – faculdade iesb;              ➢  perfil generalista;              ➢  departamento pessoal:                 ●  elaboração e fechamento de folha de pagamento; encargos sociais  admissões  cálculo                    de férias  cálculos de 13º salário;                 ●  admissões e rescisões contratuais;                 ●  envio de rais  dirf e caged;                 ●  preparação dos documentos para homologação  garantindo o cumprimento dos                    procedimentos legais;                 ●  conhecimento e domínio no esocial;                 ●  acompanhamento na implantação do e social e reforma trabalhista              ➢  recursos humanos:                 ●  responsável pelo recrutamento e seleção de novos colaboradores;                 ●  desenvolve planos de carreiras;                 ●  cargos e salários                  ●  entrevista de desligamento                  ●  avaliação de desempenho pessoal                  ●  treinamento e desenvolvimento de acordo com as necessidades levantadas.                 ●  integração de funcionários.                 ●  intermediação na solução de conflitos.                 ●  dissemina cultura organizacional;           graduação/cursos mba em gestão estratégica de pessoas      estácio de sá - concluído em 12/2019,,,,2019-12,notknown,,,,,,gestão estratégica de pessoas,,mba,false,deg-1,mba,mba,,,,faculdade iesb
cv52099.xml,graduação em psicologia centro universitário udf - concluído em 12/2018,,,,2018-12,notknown,,,,,,psicologia,,graduação em psicologia,false,deg-2,bachelors,bachelors,,,,centro universitário udf
cv52099.xml,graduação em gestão de recursos humanos   faculdade jk - asa norte concluído em 12/2012 técnico em administração senac -1000 h/a departamento pessoal vellux tecnologia - 48 h/a treinamento e desenvolvimento senac - 20 h/a recrutamento e seleção senac - 40 h/a,,,,2012-12,notknown,,,,,2012-12,técnico,,graduação em gestão de recursos humanos,true,deg-3,bachelors,bachelors,,,,faculdade jk - asa norte
cv52099.xml,legislação trabalhista senac - 30 h/a pessoas  liderança e rh fgv - 12 h/a administração de recursos humanos cursos abrafordes - 60 h/a curso e-social cefis - 3:25 h/a,,,,,,,,,,,liderança e rh,,,,deg-4,,,,,,senac
cv45197.xml,fundação getúlio vargas  fgv pós graduação em administração de empresas março de 2016 - junho de 2018,,,,2018-06,,,2016-03,,,,administração de empresas,,pós graduação em administração de empresas,false,deg-2,bachelors,bachelors,,,,fundação getúlio vargas  fgv
cv45197.xml,universidade brasília  unb licenciatura em computação janeiro de 2005 - dezembro de 2009,,,,2009-12,,,2005-01,,,2009-12,,,,,deg-1,,,,,,universidade brasília  unb
cv44959.xml,cursando 1° semestre de ciencias da computação - iesb,,,,,,,,,,,,,,false,deg-1,,,,,,iesb
cv52132.xml,30/12/2018 livre senac,2018-12-30,,,,notknown,,,,,,,,,false,deg-2,,,,,,senac
cv52132.xml,01/01/2015 -   30/12/2016    superior em análise e desenvolvimento de sistemas     uniceub 01/07/2017 - pós graduação em banco de dados e business intelligence com ênfase em software,2016-12-30,,,,2015-01-01,,,2016-12-30,,,ênfase,,pós graduação em banco de dados e business intelligence,,deg-1,bachelors,bachelors,,,,uniceub
cv53048.xml,pós-graduação - especialização perícia digital  ucb. (julho de 2009) - concluído,,,,2009-07,notknown,,,,,2009-07,perícia digital,,pós-graduação,true,deg-1,masters,masters,,,,ucb
cv53048.xml,graduação ciência da computação  unip. (janeiro de 2005) - concluído,,,,2005-01,notknown,,,,,2005-01,ciência da computação,,graduação,true,deg-2,bachelors,bachelors,,,,unip
cv44255.xml,mba executivo em gerenciamento de projetos - concluído em 2006 fgv - fundação getúlio vargas,,,2006,,notknown,,,,2006,,executivo,,mba,true,deg-1,mba,mba,,,,fgv - fundação getúlio vargas
cv44255.xml,lato sensu em administração de bancos de dados - concluído em 1999 universidade metodista de são paulo,,,1999,,notknown,,,,1999,,lato sensu,,,true,deg-2,,,br,são paulo,,universidade metodista de são paulo
cv44255.xml,bacharelado em matemática com informática - concluído em 1997 fundação santo andré,,,1997,,notknown,,,,1997,,informática,,bacharelado em matemática,true,deg-3,bachelors,bachelors,,,,fundação santo andré
cv51290.xml,• superior completo - universidade são judas tadeu  • bacharel em sistemas de informação  • ano de conclusão: 2007,,,2007,,notknown,,,,2007,,sistemas de informação,,bacharel em sistemas de informação,true,deg-1,bachelors,bachelors,,,,universidade são judas tadeu
cv51290.xml,• 2º grau completo - colégio argumento - objetivo  • técnico em processamento de dados.,,,,,,,,,,,,,,true,deg-2,,,,,,colégio argumento
cv51688.xml,faap - fundação armando álvares penteado administração de empresas  analise de sistemas  1976 - 1981,,,1981,,,1976,,,1981,,administração de empresas,,,,deg-1,,,,,,faap - fundação armando álvares penteado
cv43324.xml,processamento de dados - ucb - universidade católica de brasília (1999).  certificação: pmp - project management professional certification - pmi csm - certified scrum master - scrum alliance.,,,1999,,notknown,,,,1999,,,,pmp,,deg-1,pmp,certification,,,,dados - ucb - universidade católica de brasília
cv52851.xml,psicóloga pela universidade de brasília  conclusão - 2/2017.,,,,2017-02,notknown,,,,,2017-02,,,,,deg-1,,,,,,universidade de brasília
cv52741.xml,superior em  análise e  desenvolvimento de sistemas unipaulistana  (centro universitário paulistano) período: 2014 - 2018 rua madre cabrini  38 - vila mariana - são paulo - sp. www.unipaulistana.edu.br curso: análise e desenvolvimento de sistemas.  bacharel em sistemas de informação   ( incompleto ),,,2018,,,2014,,,,,sistemas de informação,,bacharel em sistemas de informação,false,deg-1,bachelors,bachelors,br,mariana,são paulo,unipaulistana  (centro universitário paulistano)
cv52741.xml,unisa  (universidade de santo amaro) período: 2006 - 2009 rua isabel schmidt  349 - santo amaro - são paulo - sp. www.unisa.br curso: bacharelado em sistemas de informação. ( 7 semestres concluídos ),,,2009,,,2006,,,2009,,7 semestres concluídos,,bacharelado em sistemas de informação,,deg-2,bachelors,bachelors,br,santo amaro,são paulo,unisa  (universidade de santo amaro)
cv52741.xml,tekno software período: 2000 - 2000 centro de informática  especializado em ferramentas oracle  borland e microsoft av. paulista  807 - 18º andar - são paulo - sp. www.teknosoftware.com.br - curso de banco de dados relacional oracle 8 - curso de linguagem de programação delphi  (versão 5),,,2000,,,2000,,,2000,,curso de banco,,,,deg-3,,,br,são paulo,sp,centro de informática  especializado
cv45664.xml,acadêmica  ult: união latino - americana de tecnologia curso: pós-graduação em  engenharia de software. início: 10/2011 - 06/2013 - concluído.,,,,2013-06,,,2011-10,,,2013-06,engenharia de software,,pós-graduação,true,deg-1,masters,masters,,,,ult
cv45664.xml,fiap: faculdade de informática e administração paulista. curso: tecnologia em análise e desenvolvimento de sistemas. início: 01/2009 - 12/2010 - concluído.  certificações  ●   certificação silk automation test technical specialization  ●   certificação scrum fundamentals certified - sfc  ●   certificação certified tester foundation level - ctfl / bstqb  ●   certificação itil foundation v3,,,,2010-12,,,2009-01,,,2010-12,,,certified tester,true,deg-2,certified tester,certification,,,,fiap
cv47999.xml,dezembro de 2018. administrando e armazenando dados com sql fundação 31 h server 2005 bradesco,,,,2018-12,notknown,,,,,,,,,false,deg-3,,,,,,administrando e armazenando dados com sql fundação
cv47999.xml,cursos  graduando em nome instituição duração desenvolvimento e análise metodologia em teste de software efti 24 h,,,,,,,,,,,,,,,deg-1,,,,,,duração
cv47999.xml,de sistemas pela udf.   modelagem de dados fundação 53 h conclusão prevista para bradesco,,,,,,,,,,,,,,,deg-2,,,,,,udf
cv47999.xml,projetando e implementando dados com sql fundação 58 h server 2005 bradesco system design overview fundação 28 h bradesco análise estruturada de sistemas fundação 31 h bradesco engenharia de requisitos fundação 26 h bradesco contato processo e desenvolvimento de software   fundação 12 h bradesco revisões  verificações e inspeções fundação 16 h bradesco liderança e gestão coach inmaid 24 h 61 9 8444 4394 comunicação efetiva sesi 10 h 61 9 8565 3158 (recado)  redação administrativa sesi 10 h comunicação no foco organizacional sesi 12 h,,,,,,,,,,,system design overview,,,,deg-4,,,,,,projetando e implementando dados com sql fundação
cv47999.xml,lógica de programação                    senai           16 h                            tecnologia da informação e comunicação   senai           14 h  krobertabraga@gmail.com,,,,,,,,,,,tecnologia da informação e comunicação,,,,deg-5,,,,,,senai
cv47294.xml,• ensino superior - bacharelado em sistemas de informação faculdade drummond,,,,,,,,,,,,,ensino superior,,deg-1,ensino superior,some college,,,,faculdade drummond
cv38194.xml,• graduação - sistemas de informação união pioneira de integração social - upis,,,,,,,,,,,sistemas de informação,,graduação,,deg-1,bachelors,bachelors,,,,união pioneira de integração social - upis
cv42788.xml,• bacharel em psicologia certificados e licenças curso básico de informática carga horária: 100 horas. instituição: senac - taguatinga - df localidade: setor g norte  área especial 39 taguatinga norte. conteúdo: windows  microsoft office (word  power point  excel) e internet.  curso de inglês básico (cursando) carga horária: semestral,,,,,,,,,,,certificados e licenças,,bacharel em psicologia,false,deg-1,bachelors,bachelors,br,taguatinga,df,senac
cv42788.xml,instituição: unb idiomas - brasília - df localidade: setor comercial sul - quadra 4 - bloco a  ed. anápolis  6° andar - asa sul  brasília - df  curso de espanhol básico carga horária: semestral,,,,,,,,,,,curso de espanhol básico,,df,,deg-2,doctorate,doctorate,br,brasília,df,unb idiomas
cv42788.xml,instituição: cilt - taguatinga - df  curso de assistente de departamento de pessoal carga horária: 200 horas,,,,,,,,,,,,,,,deg-3,,,br,taguatinga,df,cilt
cv42788.xml,instituição: senac - brasília - df localidade: setor comercial sul - quadra 6 - bloco a - edifício jessé freire - 1º andar - asa sul  brasília - df conteúdo: dinâmica de grupo  folha de pagamento  rescisão  admissão e demissão.   psicodinâmica do trabalho carga horária: 5 horas,,,,,,,,,,,conteúdo,,df,,deg-4,doctorate,doctorate,br,brasília,df,senac
cv42788.xml,instituição: eventologias - brasília - df conteúdo: da psicopatologia à psicodinâmica do trabalho ;  • organização do trabalho: as contradições entre o prescrito e o real e os modos de gestão ;  • trabalho vivo e o trabalhar: o sujeito entre o prazer e o sofrimento ;  • sofrimento patogênico  criativo e ético ;  • as defesas como estratégias de resistência e ação frente ao sofrimento ;  • sofrimento  patologia e adoecimento ;  • mobilização subjetiva e coletiva: inteligência prática  espaço de discussão  coletivo de trabalho/cooperação e reconhecimento ;  • a clínica psicodinâmica do trabalho: método e prática.,,,,,,,,,,,gestão,patologia,,,deg-5,,,br,brasília,df,eventologias
cv48176.xml,•  nível superior (3º semestre).  •  escola: uniplan  •  curso: análise e desenvolvimento de sistemas o  período: noturno o  cidade: aguas claras o  ano de conclusão: 2018   •  nível médio (3º ano).,,,,,,,,,,,,,,false,deg-1,,,,,,uniplan
cv48176.xml,•  escola: centro educacional passionista o  período: matutino o  cidade: riacho fundo 1 o  ano de conclusão: 2016,,,,,,,,,,,,,,,deg-2,,high school or equivalent,,,,centro educacional passionista
cv44221.xml,• gerenciamento do escopo de projeto - fgv - 2017,,,2017,,notknown,,,,2017,,,,,,deg-3,,,,,,fgv
cv44221.xml,• fundamentos da gestão de custos e gestão financeira - fgv - 2014,,,2014,,notknown,,,,2014,,fundamentos da gestão,,,,deg-4,,,,,,fgv
cv44221.xml,• introdução à administração estratégica - fgv - 2013,,,2013,,notknown,,,,2013,,introdução à administração estratégica,,,,deg-5,,,,,,fgv
cv44221.xml,• administração de empresas - conclusão: julho/2009 unia - centro universitário de santo andré,,,,2009-07,notknown,,,,,2009-07,administração de empresas,,,,deg-1,,,,,,unia - centro universitário de santo andré
cv44221.xml,• letras / português - inglês - incompleto: 1992 umc - universidade mogi das cruze cursos de aprimoramento e especialização   • lean it foundation  (cursando),,,1992,,notknown,,,,,,lean it foundation,,,false,deg-2,,,,,,umc - universidade mogi das cruze
cv48867.xml,• gestão de sistemas de informação  unip - conclusão dez/13  • resumo das qualificações profissionais  •  análise  desenvolvimento  implantação e manutenção de sistemas  •  padronização no desenvolvimento de aplicações  •  otimização de rotinas  reduzindo o tempo de resposta ao usuário  •  análise e pesquisa de novas tecnologias e seus impactos para as instituições  •  transposição de tecnologias para sistemas em funcionamento  • cursos recentes,,,,2013-12,notknown,,,,,2013-12,gestão de sistemas,,,,deg-1,,,,,,unip
cv48013.xml,pós-graduação em gestão de processos e análise de negócios maio/2016 - instituto de educação tecnológica - ietec curso superior em sistema de informação,,,,2016-05,notknown,,,,,2016-05,gestão de processos e análise,educação,pós-graduação em gestão de processos e análise de negócios,,deg-1,masters,masters,,,,instituto de educação tecnológica
cv48013.xml,agosto/2010 a julho/2014  - centro universitário una,,,,2014-07,,,2010-08,,,2014-07,,,,,deg-2,,,,,,centro universitário una
cv48915.xml,•  pós-graduação: engenharia de software - unieuro  2015.,,,2015,,notknown,,,,2015,,engenharia de software,,pós-graduação,,deg-1,masters,masters,,,,unieuro
cv48915.xml,•  graduação: sistemas de informação - unip  2012.,,,2012,,notknown,,,,2012,,,,graduação,,deg-2,bachelors,bachelors,,,,unip
cv48915.xml,•  ensino médio:  informática industrial  etb - taguatinga  1999.    •  técnico em administração  centro educacional número 03 - taguatinga  1995.,,,1999,,notknown,,,,1999,,informática industrial,,ensino médio,,deg-3,ensino médio,high school or equivalent,br,taguatinga,,centro educacional
cv51683.xml,espm escola superior de propaganda e marketing pós em propaganda & marketing  2004 - 2006,,,2006,,,2004,,,2006,,,,,,deg-1,,,,,,espm escola superior de propaganda e marketing
cv51683.xml,faculdades metropolitanas unidas graduado em administração de empresas  administração  negócios e marketing  2000 - 2003,,,2003,,,2000,,,2003,,administração de empresas  administração,marketing,,,deg-2,,,,,,faculdades metropolitanas unidas
cv43447.xml,mestrado mestrado em gestão do conhecimento e tecnologia da informação - universidade católica de brasília - conclusão em 2006.,,,2006,,notknown,,,,2006,,gestão do conhecimento e tecnologia,,mestrado,,deg-1,mestrado,masters,,,,informação - universidade católica de brasília
cv43447.xml,mba mba em gestão de empresas - fundação getúlio vargas - conclusão em 2002.,,,2002,,notknown,,,,2002,,gestão de empresas,,mba,,deg-2,mba,mba,,,,fundação getúlio vargas
cv43447.xml,graduação bacharelado em análise de sistemas - universidade salgado de oliveira - conclusão em 2000.,,,2000,,notknown,,,,2000,,,,graduação,,deg-3,bachelors,bachelors,,,,sistemas - universidade salgado de oliveira
cv21862.xml,upis sistemas de informação  information technology  2011 - 2015,,,2015,,,2011,,,2015,,information technology,,,,deg-1,,,,,,upis
cv44974.xml,técnico em informática- 3º semestre escola técnica de brasília - etb engenharia de computação - 1º semestre,,,,,,,,,,,engenharia de computação,,,,deg-1,,high school or equivalent,,,,escola técnica de brasília
cv44974.xml,instituto de educação superior de brasília - iesb,,,,,,,,,,,,,,,deg-2,,,,,,instituto de educação superior de brasília - iesb
cv55088.xml,internacional - uninter (2016-2018),,,2018,,,2016,,,,,,,,false,deg-2,,,,,,uninter
cv55088.xml,ensino superior em psicologia   -  instituto de ensino superior de brasília - iesb (2011-2015),,,2015,,,2011,,,2015,,psicologia,,ensino superior,,deg-3,ensino superior,some college,,,,instituto de ensino superior de brasília - iesb
cv55088.xml,pós-graduação - mba em gestão de recursos humanos - centro universitário,,,,,,,,,,,gestão de recursos humanos,,mba,,deg-1,mba,mba,,,,centro universitário
cv54325.xml,pós-graduação – tecnologia de informação para estratégia de negócios                       universidade paulista – unip                        gestão da tecnologia da informação                       universidade paulista – unip   eventos internacionais glovia user group conference 2004 – orlando  florida  usa,,,2004,,notknown,,,,2004,,tecnologia de informação para estratégia,gestão,pós-graduação,,deg-1,masters,masters,us,orlando,florida,universidade paulista - unip
cv54325.xml,glovia user group conference 2003 - tampa  florida  usa   cursos *   introdução ao big data - fia,,,2003,,notknown,,,,2003,,,,,,deg-2,,,us,tampa,florida,fia
cv54325.xml,*   desvendando a indústria 4.0 - senai sp  *   design thinking - udemy  *   serviços de datacenter e cloud computing - sonda brasil  *   signature selling method - ibm  *   executivo de vendas - datasul s/a  *   inglês (intermediário) - alumni  *   visão sistêmica - datasul s/a  *   técnicas de negociação - círculo dos profissionais de vendas  *   solution selling - sales solution  *   inglês (básico) - berlitz  *   cursos técnicos - vários (linguagens de programação  sistemas operacionais  redes  etc.),,,,,,,,,,,design thinking,,,,deg-3,,,,,,senai sp
cv51587.xml,uninove - universidade nove de julho master of business administration (mba)  negociação e vendas  2013 - 2014,,,2014,,,2013,,,2014,,vendas,,mba,,deg-1,mba,mba,,,,uninove - universidade nove de julho
cv51587.xml,gestão comercial  unip  2010 - 2012 activities and societies: gestão comercial varejista impacta treinamentos,,,2012,,,2010,,,2012,,gestão comercial,,,,deg-3,,,,,,unip
cv51587.xml,universidade paulista,,,,,,,,,,,,,,,deg-2,,,,,,universidade paulista
