cv51575.xml,universidade metodista de são paulo gestão rh  abc  2009 - 2010,,,2010,,,2009,,,2010,,gestão rh,,,,deg-2,,,br,são paulo,,universidade metodista de são paulo
cv51575.xml,universidade são marcos 1996 - 2000,,,2000,,,1996,,,2000,,,,,,deg-3,,,,,,universidade são marcos
cv53807.xml,• psicologia  no centro universitário do distrito federal- udf. 9º semestre (noturno) - previsão de término em 06/2019.,,,,2019-06,notknown,,,,,,psicologia,,,false,deg-1,,,,,,centro universitário do distrito federal- udf
cv55173.xml,(fapro) - conclusão em 2013,,,2013,,notknown,,,,2013,,,,,,deg-2,,,,,,fapro
cv55173.xml,•   inglês avançado - centro interescolar de línguas de taguatinga - conclusão em 2011,,,2011,,notknown,,,,2011,,,,,,deg-3,,,,,,centro interescolar de línguas de taguatinga
cv55173.xml,•   comunicação social - publicidade e propaganda - faculdade projeção,,,,,,,,,,,social,,,,deg-1,,,,,,faculdade projeção
cv43369.xml,áreas de atuação agile coach |  scrum master | analista de requisitos sênior especialista em processos de negócios bi  o&m  bpm  bpmn | itil.,,,,,,,,,,,o&m,,especialista em processos de negócios bi,,deg-1,especialista em processos de negócios bi,bachelors,,,,
cv44881.xml,mba executivo em administração: gestão da tecnologia da informação  - previsão de conclusão em 07/2018 fgv - fundação getúlio vargas,,,,2018-07,notknown,,,,,,executivo,,mba,false,deg-1,mba,mba,,,,fgv - fundação getúlio vargas
cv44881.xml,pós-graduação em sistemas de informação  - concluído em 08/2012 fgf - faculdade integrada da grande fortaleza,,,,2012-08,notknown,,,,,2012-08,sistemas de informação,,pós-graduação em sistemas de informação,true,deg-2,masters,masters,,,,fgf - faculdade integrada da grande fortaleza
cv44881.xml,graduação em engenharia de computação  - concluído em 07/2008 uniceub - centro universitário de brasília,,,,2008-07,notknown,,,,,2008-07,engenharia de computação,,graduação em engenharia de computação,true,deg-3,bachelors,bachelors,,,,uniceub - centro universitário de brasília
cv44112.xml,graduação: tecnologia em análise e desenvolvimento de sistema instituição: universidade brasileira de são paulo - (uniban) curso: concluído   principais objetivos profissionais: analista de sistemas .net pleno  conhecimentos técnicos: ferramentas de desenvolvimento: visual studio 2010  2012  2013  2015. visual studi code.  tecnologias de desenvolvimento c#  ef  migration  linq  angular 2  js  jquery  html 5  css 3.  gerenciamento de projetos kanban  scrum  bancos de dados microsoft sql server (2008  2012  2014).,,,2012,,,2008,,,2012,,tecnologia,,graduação,true,deg-1,bachelors,bachelors,br,são paulo,,universidade brasileira de são paulo - (uniban)
cv43619.xml,bacharel em sistemas de informação   - universidade católica de brasília. conclusão: junho/2016.,,,,2016-06,notknown,,,,,2016-06,sistemas de informação,,bacharel em sistemas de informação,,deg-1,bachelors,bachelors,,,,universidade católica de brasília
cv6499.xml,igti estratégia em arquitetura de software  ciências da computação e informática 2014 - 2015 centro universitário de brasília ciência da computação  ciências da computação e informática,,,2015,,,2014,,,2015,,estratégia,,,,deg-1,,,,,,centro universitário de brasília
cv55786.xml,bacharel em sistema de informação pós graduado - mba em gestão de ti no serviço público,,,,,,,,,,,pós graduado,,mba,,deg-1,mba,mba,,,,
cv44225.xml,bachelor of computer science - fmu - brazil: january 2011 - december 2016,,,,2016-12,,,2011-01,,,2016-12,computer science,,bachelor of computer science,,deg-1,bachelors,bachelors,,,,fmu
cv24173.xml,• curso técnico em análise e desenvolvimento de sistemas - senac (cursando),,,,,,,,,,,,,,false,deg-1,,,,,,senac
cv24173.xml,• graduação tecnologia em análise e desenvolvimento de sistemas - udf (cursando),,,,,,,,,,,tecnologia,,graduação,false,deg-2,bachelors,bachelors,,,,udf
cv47579.xml,ensino superior completo: centro universitário anhanguera de são paulo. curso: comunicação social: habilitação em design digital. período de formação: 2008/2011.,,,2011,,,2008,,,2011,,social,,ensino superior,true,deg-1,ensino superior,some college,br,são paulo,,centro universitário anhanguera de são paulo
cv21807.xml,iesb pos graduada  gerenciamento de projetos  2012 - 2013,,,2013,,,2012,,,2013,,,,,,deg-1,,,,,,iesb
cv21807.xml,faculdade michelangelo   superior completo  analista de sistemas  2004 - 2008,,,2008,,,2004,,,2008,,,,,true,deg-2,,,,,,faculdade michelangelo
cv38615.xml,centro universitário de brasília specialization  analysis and systems development.  2011 - 2012,,,2012,,,2011,,,2012,,analysis and systems development,,,,deg-1,,,,,,centro universitário de brasília
cv38615.xml,centro universitário de brasília graduation  systems analysis  2007 - 2010 cdi - politec,,,2010,,,2007,,,2010,,,,,,deg-2,,,,,,centro universitário de brasília
cv51585.xml,fundação getulio vargas   mba em gestão estratégica e econômica de negócios  administração de empresas  2011 - 2013 abemd,,,2013,,,2011,,,2013,,administração de empresas,,mba,,deg-1,mba,mba,,,,fundação getulio vargas
cv51585.xml,especialização em marketing direto  marketing direto  2007 - 2008 fundação armando álvares penteado,,,2008,,,2007,,,2008,,marketing direto,,,,deg-2,,,,,,fundação armando álvares penteado
cv51581.xml,universidade paulista / unip tecnologia em gestão comercial  information technology  2006 - 2008,,,2008,,,2006,,,2008,,tecnologia,,,,deg-1,,,,,,universidade paulista / unip
cv48646.xml,mba gestão estratégica em tecnologia da informação  inpg - interrompida 2010.,,,2010,,notknown,,,,2010,,gestão estratégica,tecnologia,mba,,deg-2,mba,mba,,,,inpg
cv48646.xml,mba em gestão segurança da informação  upis - interrompida 2006.,,,2006,,notknown,,,,2006,,gestão segurança da informação,,mba,,deg-3,mba,mba,,,,upis
cv48646.xml,• escolaridade tecnólogo  em processamento  dados - ucb-df  • pós-graduação - especialização,,,,,,,,,,,,,df,,deg-1,doctorate,doctorate,,,,ucb
cv53023.xml,acadêmica ensino superior completo em cst em análise e desenvolvimento de sistemas - faculdade anhanguera - unidade 01 - joinville sc.,,,2001,,notknown,,,,2001,,cst,,ensino superior,true,deg-1,ensino superior,some college,us,joinville,sc,faculdade anhanguera
cv51684.xml,universidade são judas tadeu administração  gestão de recursos humanos  2006 - 2008,,,2008,,,2006,,,2008,,administração  gestão,,,,deg-1,,,,,,universidade são judas tadeu
cv51684.xml,universidade metodista de são paulo publicidade e propaganda  1986 - 1991,,,1991,,,1986,,,1991,,publicidade e propaganda,,,,deg-2,,,br,são paulo,,universidade metodista de são paulo
cv47614.xml,ensino superior  análise e desenvolvimento de sistemas - metrocamp. 2014-2017,,,2017,,,2014,,,2017,,desenvolvimento de sistemas,,ensino superior,,deg-1,ensino superior,some college,,,,metrocamp
cv52102.xml,•   palestra com fábio coelho  ceo do google brasil - faculdade estácio de sá - ano 2017                               •   uml: uma introdução à modelagem - 8 horas - alura 12/2017,,,,2017-12,,2017,,,,2017-12,,,,,deg-3,,,,,,google brasil - faculdade estácio de sá
cv52102.xml,•   curso de métricas para desenvolvedores ministrado na cast informática. ano:2011 complementares                              •   curso de inglês em open english ano: 2012,,,2012,,,2011,,,2012,,curso de inglês,,,,deg-2,,,,,,desenvolvedores ministrado
cv52102.xml,nível superior completo pós graduação em andamento curso: tecnologia em análise e desenvolvimento de sistemas curso: engenharia de software lato sensu instituição: faculdade pitágoras instituição: faculdade estácio de sá treinamentos,,,,,,,,,,,curso,engenharia,pós graduação em andamento,true,deg-1,bachelors,bachelors,,,,faculdade pitágoras
cv20075.xml,.   mestrado em gestão do conhecimento e da tecnologia da informação  católica  2015 ;,,,2015,,notknown,,,,2015,,católica,,mestrado em gestão do conhecimento e da tecnologia da informação,,deg-1,mestrado em gestão do conhecimento e da tecnologia da informação,masters,,,,
cv20075.xml,.   mba em gestão executiva em ti  twa conhecer  2001 ;,,,2001,,notknown,,,,2001,,twa conhecer,,mba,,deg-3,mba,mba,,,,
cv20075.xml,.   bacharel em ciências contábeis  uneb  1989 ;,,,1989,,notknown,,,,1989,,ciências contábeis,,bacharel em ciências contábeis,,deg-2,bachelors,bachelors,,,,uneb
cv51154.xml,engenheiro eletrônico fesp - faculdade de engenharia são paulo,,,,,,,,,,,,,,,deg-1,,,,,,fesp - faculdade de engenharia são paulo
cv38677.xml,fundação universa mba  engenharia e desenvolvimento de software.  2013 - 2014,,,2014,,,2013,,,2014,,engenharia e desenvolvimento de software,,mba,,deg-1,mba,mba,,,,fundação universa
cv38677.xml,faculdade projeção bacharel  sistemas de informação  2009 - 2012,,,2012,,,2009,,,2012,,sistemas de informação,,bacharel,,deg-2,bachelors,bachelors,,,,faculdade projeção
cv42894.xml,universidade de santo amaro(unisa) - curso de ciências da computação (concluído 2005),,,2005,,notknown,,,,2005,,curso de ciências da computação,,,true,deg-2,,,,,,universidade de santo amaro(unisa)
cv42894.xml,colégio albert einstein - curso técnico de processamento de dados,,,,,,,,,,,,,,,deg-1,,,,,,colégio albert einstein
cv51662.xml,psicologia: centro universitário de brasília (uniceub) graduação concluída no segundo semestre de 2016. durante a graduação  atuei como estagiário em diversas áreas. os mais relevantes foram:,,,2016,,notknown,,,,2016,,psicologia,,graduação,true,deg-1,bachelors,bachelors,,,,centro universitário de brasília (uniceub)
cv51662.xml,inglês: centro interescolar de línguas do guará (cilg) curso de inglês concluído em 2011 - escrita  leitura e conversação.   página3,,,2011,,notknown,,,,2011,,,,,true,deg-4,,,,,,centro interescolar de línguas do guará
cv51662.xml,2) tjdft/uniceub: estágio no centro de formação do uniceub na condução de um grupo terapêutico de usuários de drogas encaminhado do tribunal de justiça do distrito federal e territórios  elaborando e executando dinâmicas que possibilitassem a reflexão e discussão sobre temas que fossem pertinentes ao grupo  como machismo  o papel social de cada um e o próprio uso de drogas  utilizando-se muitas vezes de filmes e documentários que estimulassem a discussão destes temas. o grupo estava embasado numa proposta de redução de danos  com ênfase em direitos humanos e garantia de direitos.  3) estágio em práticas profissionais em atendimento clínico individual e adulto nas abordagens psicanálise e abordagem centrada na pessoa  no centro de formação do uniceub.,,,,,,,,,,,grupo terapêutico,,,,deg-2,,,,,,uniceub: estágio no centro de formação do uniceub
cv51662.xml,4) estágio em avaliação psicológica de crianças e adultos  no centro de formação do uniceub onde eram aplicados e corrigidos diversos testes psicológicos,,,,,,,,,,,,,,,deg-3,,,,,,centro de formação do uniceub
cv48026.xml,• curso: sistemas de informação    ✓ instituição: faculdade jk gama    ✓ duração: 8 semestres (concluído).    ✓ horário: noturno.    ✓ início do curso: 03/2014.    ✓ término do curso: 11/2017.,,,,2017-11,,,2014-03,,,2017-11,,,,true,deg-1,,,,,,faculdade jk gama
cv54224.xml,bacharel em ciências da computação (dezembro de 2002) uniplan - centro universitário planalto do distrito federal,,,,2002-12,notknown,,,,,2002-12,ciências da computação,,bacharel em ciências da computação,,deg-1,bachelors,bachelors,,,,uniplan - centro universitário planalto do distrito federal
cv45324.xml,cursando psicologia - centro universitário iesb - 7º período - noturno cursos e conhecimentos:   ☑ microsoft office (básico)  internet ☑ técnico em saúde bucal,,,,,,,,,,,psicologia,,,false,deg-1,,,,,,centro universitário iesb
cv45324.xml,☑ escola técnica de saúde de planaltina,,,,,,,,,,,,,,,deg-2,,high school or equivalent,,,,escola técnica de saúde de planaltina
cv43146.xml,• ensino superior  7º semestre - sistemas de informação (cursando). conclusão no segundo semestre do ano de 2018.,,,2018,,notknown,,,,,,,,ensino superior,false,deg-1,ensino superior,some college,,,,
cv49830.xml,mba mba em gestão de projetos igti - instituto de gestão em tecnologia da informação início: 09/2017,,,,2017-09,notknown,,,,,2017-09,gestão de projetos,,mba,,deg-2,mba,mba,,,,instituto de gestão em tecnologia da informação
cv49830.xml,graduação gestão de tecnologia da informação unip - universidade paulista início: 01/2011 conclusão: 06/2013,,,,2013-06,,,2011-01,,,2013-06,gestão de tecnologia da informação,,graduação,,deg-1,bachelors,bachelors,,,,unip - universidade paulista
cv44629.xml,pós graduação em psicologia organizacional na universidade paulista - unip em curso (aos sábados),,current,,,notknown,,,,,,psicologia organizacional,,pós graduação em psicologia organizacional,false,deg-1,bachelors,bachelors,,,,universidade paulista - unip
cv44629.xml,pós graduação em gestão estratégica de pessoas na faculdade presbiteriana mackenzie ; conclusão setembro 2012,,,,2012-09,notknown,,,,,2012-09,gestão estratégica de pessoas,,pós graduação em gestão estratégica de pessoas,,deg-2,bachelors,bachelors,,,,faculdade presbiteriana mackenzie
cv44629.xml,tecnólogo em gestão de recursos humanos na faculdade de tecnologia - uniradial ; conclusão dezembro de 2010,,,,2010-12,notknown,,,,,2010-12,gestão,,,,deg-3,,,,,,faculdade de tecnologia
cv44629.xml,bacharelado em propaganda e marketing - universidade paulista - unip ; concluído em dezembro de 2007,,,,2007-12,notknown,,,,,2007-12,propaganda e marketing,,bacharelado em propaganda e marketing,true,deg-4,bachelors,bachelors,,,,universidade paulista - unip
cv44982.xml,superior cursando   ciência da computação   iesb 2017  curso montagem e configuração de computadores,,,2017,,notknown,,,,,,ciência da computação,,,false,deg-1,,,,,,iesb
cv45616.xml,ensino superior - situação: incompleto.  • sistema de informação - universidade paulista - cursando 7º semestre noturno. previsão de conclusão dezembro/2018.,,,,2018-12,notknown,,,,,,situação,,ensino superior,false,deg-1,ensino superior,some college,,,,universidade paulista
cv45616.xml,brasília - df  ____ de ~~~~~~~  2018,,,2018,,notknown,,,,,,,,df,false,deg-3,doctorate,doctorate,,,,
cv45616.xml,ensino médio - situação: completo.  • centro de educação de jovens e adultos da asa sul  cesas.  • ano de conclusão: 2010  habilidades e cursos complementares  • curso de montagem e manutenção de computadores: módulos hardware e redes - 6 meses/72 horas - microlins  • pacote office - nível: intermediário - 6 meses/72 horas - microlins,,,2010,,notknown,,,,2010,,situação,,ensino médio,true,deg-2,ensino médio,high school or equivalent,,,,centro de educação de jovens e adultos da asa sul
cv44178.xml,mestrado em engenharia  de usabilidade  usp/ipt são paulo-sp  2014,,,2014,,notknown,,,,2014,,usabilidade,,mestrado em engenharia,,deg-1,mestrado em engenharia,masters,,,,
cv44178.xml,mba em gerenciamento de projetos com ênfase em tecnologia da informação  fgv  campinas-sp  2010.,,,2010,,notknown,,,,2010,,tecnologia da informação,,mba,,deg-2,mba,mba,br,campinas,sp,fgv
cv44178.xml,especialização em análise de sistemas  puc-campinas-sp  2002,,,2002,,notknown,,,,2002,,,,,,deg-3,,,br,campinas,sp,puc-campinas
cv44178.xml,graduação em processamento de dados  fatec-sp  são paulo-sp  1997,,,1997,,notknown,,,,1997,,dados,,graduação em processamento de dados,,deg-4,bachelors,bachelors,br,são paulo,sp,fatec-sp
cv51256.xml,pós-graduação / mba: engenharia de software  fiap (2014) - concluída.,,,2014,,notknown,,,,2014,,engenharia de software,,mba,true,deg-1,mba,mba,,,,fiap
cv51256.xml,graduação: informática para gestão de negócios  fatec - faculdade de tecnologia da praia grande (2010) - concluída.  técnico:,,,2010,,notknown,,,,2010,,gestão,tecnologia,graduação,true,deg-2,bachelors,bachelors,,,,fatec - faculdade de tecnologia da praia grande
cv51256.xml,informática  etec - escola técnica estadual adolpho berezin (2003) - concluída.  outras especializações:,,,2003,,notknown,,,,2003,,,,,true,deg-3,,high school or equivalent,,,,escola técnica estadual adolpho berezin
cv43134.xml,2017 mestrando unicamp - são paulo,,,2017,,notknown,,,,2017,,,,,,deg-2,,,br,são paulo,,unicamp
cv43134.xml,2015 bacharelado matemática usp - são paulo,,,2015,,notknown,,,,2015,,matemática,,bacharelado,,deg-1,bachelors,bachelors,,,,
cv49350.xml,bacharel em ciência da computação conclusão em 1995.  fatec - faculdade de tecnologia de são paulo tecnologia em mecânica de projetos. não concluído.,,,1995,,notknown,,,,,,ciência da computação,,bacharel em ciência da computação,false,deg-4,bachelors,bachelors,br,são paulo,,fatec - faculdade de tecnologia de são paulo
cv49350.xml,ensino médio centro de educação integrada eniac - santa inês de sbc hab. profissional de técnico em processamento de dados concluído em 1989.,,,1989,,notknown,,,,1989,,,,ensino médio,true,deg-5,ensino médio,high school or equivalent,,,,centro de educação integrada eniac - santa inês de sbc
cv49350.xml,pós - graduação   faculdade estacio pos gradução em desenvolvimento mobile cursando,,,,,,,,,,,,,graduação,false,deg-1,bachelors,bachelors,,,,faculdade estacio
cv49350.xml,escola superior aberta do brasil pós graduação em engenharia de sistemas,,,,,,,,,,,engenharia de sistemas,,pós graduação em engenharia de sistemas,,deg-2,bachelors,bachelors,,,,escola superior aberta do brasil
cv49350.xml,microsoft certified solutions developer kasolution web application 20480   programming in html5 with javascript and css3 20486   developing asp.net mvc 4 web applications 20487   developing windows azure and web services   superior puc - pontifícia universidade católica de são paulo,,,,,,,,,,,,,microsoft certified solutions developer,,deg-3,microsoft certified solutions developer,certification,br,são paulo,,pontifícia universidade católica de são paulo
cv44536.xml,instituição: cursoolinesp curso: planejamento de recursos humanos carga horária: 60hs em 2018  instituição: cursoolinesp curso: recrutamento & seleção carga horária: 40hs em 2018,,,2018,,notknown,,,,,,,,,false,deg-6,,,,,,cursoolinesp
cv44536.xml,instituição: tjdft curso: preposta - a favor da requerida (empresas) carga horária: 180h em 2016,,,2016,,notknown,,,,2016,,empresas,,,,deg-5,,,,,,tjdft
cv44536.xml,instituição: faculdade projeção pós-graduação: mba gestão de recursos humanos situação atual: formada 2015,,,2015,,notknown,,,,2015,,gestão de recursos humanos,,mba,,deg-2,mba,mba,,,,faculdade projeção
cv44536.xml,instituição: senai curso: organização de empresas carga horária: 40h em 2013.,,,2013,,notknown,,,,2013,,organização de empresas,,,,deg-4,,,,,,senai
cv44536.xml,instituição: colégio e faculdade santa terezinha curso: licenciatura plena em pedagogia/ empresarial (recursos humanos) situação atual: formada 2009 formações cursos,,,2009,,notknown,,,,2009,,,,,,deg-3,,,,,,colégio e faculdade santa terezinha
cv44536.xml,instituição: faculdade estácio pós-graduação: mba gestão estratégica de pessoas situação atual: cursando,,,,,,,,,,,gestão estratégica de pessoas,,mba,false,deg-1,mba,mba,,,,faculdade estácio
cv51601.xml,nível superior (psicologia - iesb/df),,,,,,,,,,,psicologia,,df,,deg-1,doctorate,doctorate,,,,iesb
cv51580.xml,universidade anhembi morumbi mba em gestão comercial  mba em gestão comercial  2008 - 2010,,,2010,,,2008,,,2010,,gestão comercial,,mba,,deg-1,mba,mba,,,,universidade anhembi morumbi
cv51580.xml,esan - escola superior de administração e negócios administrador  administração de empresas  1992 - 1996 eepg joão ramalho segundo grau,,,1996,,,1992,,,1996,,administração de empresas,,,,deg-2,,,,,,escola superior de administração e negócios
cv52563.xml,centro  universitário  fundação  unirg  – gurupi  início  em  2006/2 conclusão em 2011/1 .     cursos  laudos  e  pareceres  - instrumentação  profissional  para psicólogos – idepp – palmas -to.     psicologia organizacional – recrutamento e seleção.     informatica básica.,,,,2011-01,,,2006-02,,,2011-01,instrumentação,,,,deg-1,,,br,gurupi,,centro  universitário  fundação  unirg
cv51479.xml,• bacharel em administração de empresas. universidade estácio de sá  conclusão em 2017.,,,2017,,notknown,,,,2017,,administração de empresas,,bacharel em administração de empresas,,deg-1,bachelors,bachelors,,,,universidade estácio de sá
cv51479.xml,• ensino médio completo. etec de são josé dos campos  conclusão em 2012.,,,2012,,notknown,,,,2012,,etec de são josé dos campos,,ensino médio completo,true,deg-2,ensino médio completo,high school or equivalent,,,,
cv55737.xml,•  pós-graduado em governança de ti - senac/df - 2013 ;,,,2013,,notknown,,,,2013,,,,df,,deg-1,doctorate,doctorate,,,,senac
cv55737.xml,•  mba - pós-graduado em gestão de projetos  ucb/universa - 2009 ;,,,2009,,notknown,,,,2009,,pós-graduado,,mba,,deg-2,mba,mba,,,,ucb
cv55737.xml,•  graduado em processamento de dados  ucb - 2003.,,,2003,,notknown,,,,2003,,,,,,deg-3,,,,,,ucb
cv51685.xml,ces - centre english studies - dublin / ireland general english  idioma  2011 - 2011,,,2011,,,2011,,,2011,,,,,,deg-1,,,ie,dublin,,centre english studies
cv51685.xml,universidade anhembi morumbi marketing com ênfase em vendas  marketing  2008 - 2010,,,2010,,,2008,,,2010,,marketing,,,,deg-2,,,,,,universidade anhembi morumbi
cv51685.xml,unicid - universidade cidade de sao paulo desenvolvimento de softwares  informatica  2004 - 2006,,,2006,,,2004,,,2006,,,,,,deg-3,,,br,sao paulo,,unicid - universidade cidade de sao paulo
cv48910.xml,superior: processamento de dados  > universidade bandeirante (concluído em 12/2008),,,,2008-12,notknown,,,,,2008-12,,,,true,deg-1,,,,,,universidade bandeirante
cv48910.xml,2º grau: técnico eletrônica (concluído) > colégio torricelli - guarulhos,,,,,,,,,,,técnico eletrônica,,,true,deg-2,,,br,guarulhos,,colégio torricelli
cv44960.xml,cursando: 7º semestre em engenharia da computação faculdade: centro universitário iesb - campus asa sul previsão de graduação: jan/2015 - dez/2020 período das aulas: noturno,,,,2020-12,,,2015-01,,,,engenharia da computação,,graduação,false,deg-1,bachelors,bachelors,,,,centro universitário iesb - campus asa sul
cv53095.xml,sydney | 2018 •   manutenção em multiplas aplicações. •   responsável por gerir todas as modificações e testes  realizei importantes superior em sistemas de melhorias e correções de processos assim como novos desenvolvimentos  informação deixando as aplicações prontas para serem liberadas para o cliente. universidade cruzeiro do sul •   experiência com restful  comunicação com backend  broadcast receiver  json ,,,2018,,notknown,,,,,,backend,,,false,deg-1,,,,,,universidade cruzeiro do sul
cv53095.xml,são paulo | 2007 - 2011 google cloud management  armazenamento de dados interno  sql  listview  google maps para localização e montagem rotas em mapas  git & github para controle de versões. curso de inglês intensivo •   participação em reuniões sempre apresentando novas ideias para o kaplan institute desenvolvimento da aplicação e melhoria da performance.,,,2011,,,2007,,,2011,,google cloud management,,,,deg-2,,,,,,kaplan institute
cv43933.xml,fiap fmu sistemas de internet (programação) comunicação social: publicidade e propaganda término em 2012 término: 2009,,,2012,,notknown,,,,2012,,,,,,deg-6,,,,,,fiap
cv43933.xml,anhembi morumbi centro universitário senac webdesign (tecnologia e programação) comunicação e artes: design gráfico término em 2000 término: 2005,,,2000,,notknown,,,,2000,,tecnologia e programação,,,,deg-5,,,,,,centro universitário senac
cv43933.xml,• takano curso de editoração (photoshop  pagemaker  illustrator e quark xpress) ;  • senac curso de design gráfico (photoshop  illustrator  indesign avançado) ;  • impacta tecnologia web design  photoshop e illustrator avançados ;  • eng tecnologia (dreamweaver  flash  php  asp  todos avançados) ;,,,,,,,,,,,design gráfico,tecnologia,,,deg-1,,,,,,senac
cv43933.xml,• escola senai theobaldo de nigris produção gráfica  fluxograma do processo de produção  cores e imagens  impressão  tipografia  acabamento e controle de qualidade no acabamento gráfico ;  • pancrom curso de produção gráfica ;,,,,,,,,,,,gráfico,,,,deg-2,,high school or equivalent,,,,escola senai theobaldo de nigris produção gráfica
cv43933.xml,• escola panamericana de artes publicidade / criação ;,,,,,,,,,,,,,,,deg-3,,high school or equivalent,,,,escola panamericana de artes publicidade
cv43933.xml,• curso sobre nova ortografia e o mercado editorial ministrado por jiro takahashi  • wiseup (inglês intermediário) ;  • cultura espanhola (iniciante).  tecnólogo: graduação:,,,,,,,,,,,,,graduação,,deg-4,bachelors,bachelors,,,,ministrado por jiro takahashi
cv48265.xml,ensino superior - redes de computadores faculdade de tecnologia equipe darwin conclusão: dezembro / 2014,,,,2014-12,notknown,,,,,2014-12,redes de computadores,,ensino superior,,deg-1,ensino superior,some college,,,,faculdade de tecnologia equipe darwin
cv48265.xml,pós graduação - gestão de tecnologia da informação instituto de gestão e tecnologia da informação. cursando,,,,,,,,,,,gestão de tecnologia da informação,,pós graduação,false,deg-2,bachelors,bachelors,,,,instituto de gestão e tecnologia da informação
cv44258.xml,profissionalmente e de maneira produtiva  facitec - noturno contribuindo para o desenvolvimento da organização como um todo.,,,,,,,,,,,,,,,deg-1,,,,,,facitec
