cv44242.xml,3º grau completo - unisanta - santos - curso de ciências da computação formação - 12/2007,,,,2007-12,notknown,,,,,2007-12,curso de ciências da computação,,,true,deg-1,,,br,santos,,unisanta
cv51682.xml,universidade são marcos 1988  ciencias sociais  1985 - 1988,,,1988,,,1985,,,1988,,,,,,deg-1,,,,,,universidade são marcos
cv51682.xml,universidade são marcos 1988  ciencias sociais  1985 - 1988 cardeal motta colegial  1982 - 1984,,,1988,,notknown,,,,1988,,,,,,deg-2,,,,,,universidade são marcos
cv44275.xml,•  ensino médio completo; •  técnico em informática (escola técnica de ceilândia); •  suporte técnico em informática (etc- escola técnica de ceilândia),,,,,,,,,,,,,ensino médio completo,true,deg-1,ensino médio completo,high school or equivalent,,,,escola técnica de ceilândia
cv44275.xml,•  ensino superior cursando (ciência da computação 3º semestre- iesb) ;  •  introdução à aprendizagem de máquina com o microsoft azure (mva) ;,,,,,,,,,,,ciência da computação,,ensino superior,false,deg-2,ensino superior,some college,,,,iesb
cv44275.xml,•  html  básico (23 horas) (escola virtual fundação bradesco) ;,,,,,,,,,,,,,,,deg-3,,high school or equivalent,,,,escola virtual fundação bradesco
cv44275.xml,•  html avançado(64 horas) (escola virtual fundação bradesco) ;,,,,,,,,,,,,,,,deg-4,,high school or equivalent,,,,escola virtual fundação bradesco
cv44275.xml,•  ilustração e design gráfico para web(25 horas) (escola virtual fundação bradesco) ;,,,,,,,,,,,ilustração e design gráfico para web,,,,deg-5,,high school or equivalent,,,,escola virtual fundação
cv44275.xml,•  inovando com css (26 horas) (escola virtual fundação bradesco) ;,,,,,,,,,,,,,,,deg-6,,high school or equivalent,,,,escola virtual fundação bradesco
cv54891.xml,• graduada em psicologia pela universidade católica de brasília  conclusão em 2016. •,,,2016,,notknown,,,,2016,,psicologia,,,,deg-1,,,,,,universidade católica de brasília
cv51579.xml,fmu - são paulo administração de empresas  1990 - 1993 impacta technology,,,1993,,,1990,,,1993,,administração de empresas,,,,deg-1,,,br,são paulo,,fmu
cv51579.xml,sap university,,,,,,,,,,,,,,,deg-2,,,,,,sap university
cv51584.xml,fundação vanzolini   master of business administration - mba  finanças  2004 - 2005,,,2005,,,2004,,,2005,,finanças,,mba,,deg-1,mba,mba,,,,fundação vanzolini
cv51584.xml,ibmec master of business administration - mba  finanças  2000 - 2001,,,2001,,,2000,,,2001,,finanças,,mba,,deg-2,mba,mba,,,,ibmec
cv51584.xml,fundação getulio vargas especialização  finanças  1997 - 1997,,,1997,,,1997,,,1997,,finanças,,,,deg-3,,,,,,fundação getulio vargas
cv51584.xml,universidade sant'anna bacharelado em ciências humanas  economia  1986 - 1990,,,1990,,,1986,,,1990,,economia,,bacharelado em ciências humanas,,deg-4,bachelors,bachelors,,,,universidade sant'anna
cv47921.xml,scrum - fiap - jun/2015,,,,2015-06,notknown,,,,,2015-06,,,,,deg-2,,,,,,fiap
cv47921.xml,nível superior   faculdade radial são paulo tecnologia em processamento de dados - (conclusão em 1996)   cursos extra-curriculares/participações em palestras,,,1996,,notknown,,,,1996,,tecnologia,,,,deg-1,,,,,,faculdade radial são paulo
cv43358.xml,mba: fundação getúlio vargas (gerenciamento de projetos) - incompleto,,,,,,,,,,,,,mba,false,deg-1,mba,mba,,,,fundação getúlio vargas
cv43358.xml,especialização: universidade de brasília (desenvolvimento de sistemas distribuídos com orientação a objetos),,,,,,,,,,,,,,,deg-2,,,,,,universidade de brasília
cv43358.xml,graduação: universidade católica de brasília,,,,,,,,,,,,,graduação,,deg-3,bachelors,bachelors,,,,universidade católica de brasília
cv43358.xml,(bacharelado em ciência da computação)  cursos extra curricular managment 3.0 entidade: plano pro2 período: 16 horas fundamentos em itil v3 entidade: office it período: 20 horas fundamentos em cobit entidade: office it período: 20 horas agregando valor com bpm entidade: elo group período: 16 horas execução de projetos de transformação de processos entidade: elo group período: 8 horas processo com foco em ti entidade: elo group período: 12 horas scrum entidade: bancoob período: 16 horas inglês entidade: brasas período: 2 5 anos,,,,,,,,,,,ciência da computação,,bacharelado em ciência da computação,,deg-4,bachelors,bachelors,,,,
cv44538.xml,pós-graduando em psicologia organizacional - instituto kalitek - conclusão - dezembro 2018,,,,2018-12,notknown,,,,,,pós-graduando,,,false,deg-2,,,,,,instituto kalitek
cv44538.xml,pós-graduando em gestão de pessoas - instituto kalitek - conclusão 2018 - dezembro 2018,,,,2018-12,,2018,,,,,gestão,,,false,deg-3,,,,,,instituto kalitek
cv44538.xml,graduada em recursos humanos - uniplan/2016,,,2016,,notknown,,,,2016,,,,,,deg-1,,,,,,uniplan
cv41283.xml,superior completo-universidade ibirapuera gestão de recursos humanos,,,,,,,,,,,gestão de recursos humanos,,,true,deg-1,,,,,,universidade ibirapuera
cv41283.xml,pós graduação - inpg gestão estratégica de pessoas,,,,,,,,,,,gestão estratégica de pessoas,,pós graduação,,deg-2,bachelors,bachelors,,,,inpg
cv51690.xml,australian college of english ace ielts  english  2004 - 2004,,,2004,,,2004,,,2004,,english,,,,deg-1,,,,,,australian college of english ace
cv51690.xml,fasp ba  business adm system analysis  1982 - 1985,,,1985,,,1982,,,1985,,business adm system analysis,,ba,,deg-2,bachelors,bachelors,,,,fasp
cv43315.xml,mba governança em ti - universidade unieuro ;,,,,,,,,,,,governança,,mba,,deg-1,mba,mba,,,,universidade unieuro
cv43315.xml,graduação em redes de computadores - faculdade uneb.,,,,,,,,,,,redes de computadores,,graduação em redes de computadores,,deg-2,bachelors,bachelors,,,,faculdade uneb
cv53153.xml,academica  • graduação em direito - (unifeo)  • graduação em análise de sistemas - (unisantanna)  • técnico em processamento de dados - (fito),,,,,,,,,,,unifeo,,graduação em direito,,deg-1,bachelors,bachelors,,,,
cv51703.xml,instituição: unimep curso: graduação em análise de sistemas período: de 08/1998 a 08/2002,,,,2002-08,,,1998-08,,,2002-08,período,,graduação em análise de sistemas,,deg-1,bachelors,bachelors,,,,unimep
cv45090.xml,• teologia  • secretariado executivo  • faturista (faturamento médico hospitalar)  • técnico em informática para web - uniceub,,,,,,,,,,,teologia,,,,deg-1,,,,,,uniceub
cv45090.xml,• análise e desenvolvimento de sistemas - superior: cursando uniceub,,,,,,,,,,,,,,false,deg-2,,,,,,uniceub
cv48381.xml,•  graduação bacharel em sistemas de informação unidesc • brasília/df conclusão em mês/2013,,,2013,,notknown,,,,2013,,,,graduação,,deg-2,bachelors,bachelors,br,brasília,df,unidesc
cv48381.xml,•  pós-graduação banco de dados iesb - centro universitário • brasília/df em andamento,,,,,,,,,,,banco de dados,,pós-graduação,,deg-1,masters,masters,br,brasília,df,iesb - centro universitário
cv42684.xml,| faculdade patos de minas - 2015,,,2015,,notknown,,,,2015,,,,,,deg-2,,,,,,faculdade patos de minas
cv42684.xml,graduada em psicologia / fpm,,,,,,,,,,,psicologia / fpm,,,,deg-1,,,,,,fpm
cv42684.xml,pós-graduada em psicologia: orientação profissional / faveni      pós-graduação em recursos humanos e finanças/ faveni (cursando),,,,,,,,,,,recursos humanos e finanças,,pós-graduação em recursos humanos e finanças,false,deg-3,masters,masters,,,,faveni
cv47632.xml,superior trancado (2º semestre) em análise e desenvolvimento de sistemas - universidade cruzeiro do sul (unicsul) início:,,,,,,,,,,,,,,,deg-1,,,,,,sistemas - universidade cruzeiro do sul (unicsul)
cv47632.xml,superior trancado (8º semestre) em engenharia civil - universidade nove de julho (uninove). início:,,,,,,,,,,,engenharia civil,,,,deg-2,,,,,,universidade nove de julho (uninove)
cv56254.xml,•   pós-graduação - eng. de requisitos de soft. - uniceub - 2016 trancado,,,2016,,notknown,,,,2016,,eng. de requisitos,,pós-graduação,,deg-2,masters,masters,,,,uniceub
cv56254.xml,•   sistemas de informação - faculdade fortium - 01/2012,,,,2012-01,notknown,,,,,2012-01,,,,,deg-1,,,,,,faculdade fortium
cv43328.xml,pós graduação: faculdade: uniceub  curso: gestão estratégica da tecnologia da informação cidade: brasília conclusão em: 2018 (dez)   curso superior:,,,,2018-12,notknown,,,,,,gestão estratégica da tecnologia da informação,,pós graduação,false,deg-1,bachelors,bachelors,,,,uniceub
cv43328.xml,faculdade: uniceub  curso: análise de sistemas concluído em: 2012 cidade: brasília,,,2012,,notknown,,,,2012,,,,,true,deg-2,,,,,,uniceub
cv51430.xml,bacharelado incompleto - ciências contábeis  udf   -  brasília  df,,,,,,,,,,,ciências contábeis,,bacharelado,false,deg-1,bachelors,bachelors,br,brasília,df,udf
cv53270.xml,bacharelado em sistemas de informação na uniban - de janeiro de 2005 a dezembro de 2008,,,,2008-12,,,2005-01,,,2008-12,sistemas de informação,,bacharelado em sistemas de informação,,deg-1,bachelors,bachelors,,,,uniban
cv52213.xml,scrum master / analista de negócios/requisitos  s +55 61 984098551 _ marciasillva@gmail.com   resumo idiomas  analista de sistemas com mba em gestão de projetos de espanhol avançado software  amplos conhecimentos em levantamento e análise inglês intermediário de requisitos  metodologia ágil scrum e metodologia rup  conhecimentos em planejamento de testes e execução de testes  elaboração de manuais e vídeos para treinamentos. educação,,,,,,,,,,,analista de sistemas,,mba,,deg-1,mba,mba,,,,
cv51385.xml,bacharel em ciência da computação (centro universitário iesb),,,,,,,,,,,ciência da computação,,bacharel em ciência da computação,,deg-1,bachelors,bachelors,,,,centro universitário iesb
cv37384.xml,mba governança nas tecnologias da informação  2014 - 2015 universidade salgado de oliveira,,,2015,,,2014,,,2015,,governança nas tecnologias da informação,,mba,,deg-2,mba,mba,,,,universidade salgado de oliveira
cv37384.xml,ipog - instituto de pós-graduação e graduação,,,,,,,,,,,,,pós-graduação,,deg-1,masters,masters,,,,ipog - instituto de pós
cv45902.xml,mestrado - engenharia de software usp - universidade de são paulo   -  são paulo  sp 2017-03 - 2019-03,,,,2019-03,,,2017-03,,,,engenharia de software,,mestrado,false,deg-1,mestrado,masters,br,são paulo,sp,universidade de são paulo
cv45902.xml,pós graduação em banco de dados. universidade federal de goiás 2012,,,2012,,notknown,,,,2012,,banco de dados,,pós graduação em banco de dados,,deg-2,bachelors,bachelors,,,,universidade federal de goiás
cv45902.xml,pós graduação - desenvolvimento de aplicações web universidade federal de goiás 2011,,,2011,,notknown,,,,2011,,desenvolvimento de aplicações web,,pós graduação,,deg-3,bachelors,bachelors,,,,universidade federal de goiás
cv45902.xml,graduação centro universitário de anápolis 2010   serviço militar país: brasil força armada: aeronáutica posição: soldado s2,,,2010,,notknown,,,,2010,,aeronáutica,,graduação,,deg-4,bachelors,bachelors,,,,centro universitário de anápolis
cv47643.xml,• superior completo: processamento de dados - unib - universidade ibirapuera - 1989/1991,,,1991,,,1989,,,1991,,,,,true,deg-1,,,,,,unib - universidade ibirapuera
cv43893.xml,pós-graduação mba em desenvolvimento de aplicações para dispositivos móveis - inicio em 05/2015 - trancada. - instituição: fiap,,,,2015-05,notknown,,,,,2015-05,desenvolvimento de aplicações para dispositivos móveis,,mba,,deg-1,mba,mba,,,,fiap
cv43893.xml,pós-graduação especialização em engenharia de software com soa - concluída em out/2011 - instituição: veris - ibta,,,,2011-10,notknown,,,,,2011-10,engenharia de software,,pós-graduação,true,deg-2,masters,masters,,,,ibta
cv43893.xml,graduação desenvolvimento de aplicações para internet - concluída em 12/2008 - instituição: faculdade impacta de tecnologia.,,,,2008-12,notknown,,,,,2008-12,desenvolvimento de aplicações para internet,,graduação,true,deg-3,bachelors,bachelors,,,,faculdade impacta de tecnologia
cv44082.xml,.  mba em gestão de projetos instituição: unieuro - centro universitário euro-americano início: ago/2009 - término: nov/2010,,,,2010-11,,,2009-08,,,2010-11,instituição,,mba,,deg-1,mba,mba,,,,unieuro - centro universitário euro-americano
cv44082.xml,.  pós-graduação em engenharia de software com ênfase em cmmi e mps.br instituição: uneb - união educacional de brasília início: ago/2006 - trancado (abr/2007),,,,2007-04,,,2006-08,,,2007-04,ênfase,,pós-graduação em engenharia de software,,deg-2,masters,masters,,,,uneb - união educacional de brasília
cv44082.xml,.  graduação em administração com habilitação em análise de sistemas instituição: iesb - instituição de educação superior de brasília início: jul/2001 - término: jul/2005,,,,2005-07,,,2001-07,,,2005-07,habilitação,educação,graduação em administração,,deg-3,bachelors,bachelors,,,,iesb - instituição de educação superior de brasília
cv53683.xml,• escolaridade ensino médio completo.  • curso técnico - informática pacote office / rotinas administrativas microlins educação e profissão  • graduação gestão de ti  faculdade nossa cidade / concluído.,,,,,,,,,,,microlins educação e profissão,gestão,ensino médio completo,true,deg-1,ensino médio completo,high school or equivalent,,,,faculdade nossa cidade
cv44200.xml,● mba em engenharia de software orientada a serviços (soa)  fiap  conclusão 04/2016,,,,2016-04,notknown,,,,,2016-04,serviços,,mba,,deg-1,mba,mba,,,,fiap
cv44200.xml,● graduação em análise e desenvolvimento de softwares. unicsul.,,,,,,,,,,,desenvolvimento de softwares,,graduação em análise e desenvolvimento de softwares,,deg-2,bachelors,bachelors,,,,unicsul
cv44200.xml,● graduação em ciência da computação. unicsul.,,,,,,,,,,,ciência da computação,,graduação em ciência da computação,,deg-3,bachelors,bachelors,,,,unicsul
cv44739.xml,ensino médio,,,,,,,,,,,,,ensino médio,,deg-1,ensino médio,high school or equivalent,,,,
cv47938.xml,pós-graduação em gestão de projetos - ênfase em pmbok - 2014 faculdade impacta tecnologia,,,2014,,notknown,,,,2014,,ênfase,,pós-graduação em gestão de projetos,,deg-1,masters,masters,,,,faculdade impacta tecnologia
cv47938.xml,bacharel em ciência da computação - 2006 universidade mackenzie - projeto de conclusão de curso: desenvolvimento de jogos em rede bluetooth utilizando j2me,,,2006,,notknown,,,,2006,,ciência da computação,,bacharel em ciência da computação,,deg-2,bachelors,bachelors,,,,universidade mackenzie
cv44334.xml,• mba em governança de ti - centro universitário unieuro   2009 ;,,,2009,,notknown,,,,2009,,governança de ti,,mba,,deg-1,mba,mba,,,,centro universitário unieuro
cv44334.xml,• bacharelado em análise de sistemas - upis faculdades integradas   1999.  principais conquistas • alcance de metas de faturamento  acima das medias estimadas para empresa indra  junto ao cliente caixa ;  • motivação de equipes para cumprimento de metas e projetos específicos do cliente caixa economica ;  • êxito na gestão do contrato de serviços da prestadora dataprev  ao cliente ministério do trabalho ;  • implantação de sistemas do cliente ministério do trabalho e emprego  em todo o brasil ;  • cumprimento de metas e demandas de projetos da secretaria de fiscalização do trabalho  cliente mte ;  • cumprimento de metas de atendimento e qualidade aos clientes  mte.,,,1999,,notknown,,,,1999,,gestão,ministério,bacharelado em análise de sistemas,,deg-2,bachelors,bachelors,,,,upis faculdades integradas
cv47533.xml,fiap - desenvolvimento e análise de sistemas - 2012 / 2013,,,2013,,,2012,,,2013,,,,,,deg-1,,,,,,fiap
cv47533.xml,fei - faculdade de engenharia industrial - engenharia elétrica - 2002 / 2010,,,2010,,,2002,,,2010,,engenharia elétrica,,,,deg-2,,,,,,fei - faculdade de engenharia industrial
cv41240.xml,mba em business intelligence concluído em 2014  universidade paulista - unip - são paulo - sp,,,2014,,notknown,,,,2014,,business intelligence,,mba,true,deg-2,mba,mba,br,são paulo,sp,universidade paulista - unip
cv41240.xml,faculdade de engenharia da computação concluído em 2012,,,2012,,notknown,,,,2012,,,,,true,deg-3,,,,,,faculdade de engenharia da computação
cv41240.xml,senai - santos-sp curso de técnico de informática com ênfase em redes locais duração 2 anos - concluído em 2002.,,,2002,,notknown,,,,2002,,curso de técnico,,,true,deg-4,,,br,santos,sp,senai
cv41240.xml,mba - fiap,,,,,,,,,,,,,mba,,deg-1,mba,mba,,,,fiap
cv51663.xml,graduada em psicologia pela faculdade iesb conclusão: dezembro de 2016 *curso concluído na condição de bolsista do prouni 100%,,,,2016-12,notknown,,,,,2016-12,psicologia pela faculdade iesb,,,true,deg-1,,,,,,iesb
cv44402.xml,escola: udf centro de ens. unificado do df ltda curso: sistemas de informacao ano/semestre: 02 semestre (conclusão: 06/2021) período de aula: noturno cidade: brasilia estado: df   informações adicionais:,,,,2021-06,notknown,,,,,,informações adicionais,,df,false,deg-1,doctorate,doctorate,,,,udf centro de ens. unificado do df ltda
cv48760.xml,faculdade ibta 2012 . curso superior de tecnologia em redes de computadores,,,2012,,notknown,,,,2012,,curso superior de tecnologia,,,,deg-1,,,,,,faculdade ibta
cv48760.xml,e.t.e professor aprígio gonzaga 2007 . ensino médio técnico em eletrônica,,,2007,,notknown,,,,2007,,,,ensino médio,,deg-2,ensino médio,high school or equivalent,,,,técnico em eletrônica
cv52822.xml,bacharel em sistema de informação concluído em 2011  udf - centro universitário do distrito federal,,,2011,,notknown,,,,2011,,sistema de informação,,bacharel em sistema de informação,true,deg-1,bachelors,bachelors,,,,udf - centro universitário do distrito federal
cv44174.xml,• pós-graduação em análise de sistemas (fundação  álvares penteado -fecap).,,,,,,,,,,,sistemas,,pós-graduação em análise de sistemas,,deg-1,masters,masters,,,,fundação  álvares penteado -fecap
cv44174.xml,• administração de empresas (fac. ciências econômicas s.paulo facesp).,,,,,,,,,,,administração de empresas,,,,deg-2,,,,,,fac. ciências econômicas s.paulo facesp
cv44174.xml,• engenharia (até o 3º ano) (faculdade engenharia são paulo - fesp).,,,,,,,,,,,engenharia,,,,deg-3,,,,,,faculdade engenharia são paulo - fesp
cv49794.xml,ensino técnico: técnico de informática com ênfase em programação - centro paula souza,,,,,,,,,,,técnico de informática,,ensino técnico,,deg-1,ensino técnico,high school or equivalent,,,,centro paula souza
cv49794.xml,- ensino superior: ciência da computação - universidade paulista   fam - analise e desenvolvimento de sistemas.  conhecimentos: linguagem de programação:  • java: jdbc  spring mvc/batch/boot  ejb  jpa  hibernate  jsf  jsp  tdd  junit.  • front-end: html  css  javascript  bootstrap  angular.  • servidores de aplicação: tomcat  wildfly  weblogic  jboss.  banco de dados: • bancos: sql server  firebird  mysql  oracle  postgrees.  • conhecimentos: select  insert  update  delete  create  alter  drop  coalesce  procedure  function.,,,,,,,,,,,ciência da computação,,ensino superior,,deg-2,ensino superior,some college,,,,universidade paulista
cv51624.xml,• ensino superior em psicologia concluído em 1º sem de 2018 instituição: centro universitário iesb,,,2018,,notknown,,,,,,psicologia,,ensino superior,false,deg-1,ensino superior,some college,,,,centro universitário iesb
cv51624.xml,• ensino superior em gestão de recursos humanos concluído em 2º sem de 2012 instituição: centro universitário iesb,,,2012,,notknown,,,,2012,,gestão de recursos humanos,,ensino superior,true,deg-2,ensino superior,some college,,,,centro universitário iesb
cv43064.xml,especialização em engenharia de software - iesb - atualmente cursando,,current,,,notknown,,,,,,engenharia de software,,,false,deg-1,,,,,,iesb
cv43064.xml,especialização em gerenciamento de projetos - uneb          superior - faculdade de tecnologia em processamento de dados – uniceub,,,,,,,,,,,,,,,deg-2,,,,,,uneb
cv55708.xml,tecnologia em análise e desenvolvimento de sistemas - instituto superior fátima (concluído).,,,,,,,,,,,tecnologia,,,true,deg-1,,,,,,instituto superior fátima
cv54993.xml,•  ensino superior completo - psicologia,,,,,,,,,,,psicologia,,ensino superior,true,deg-1,ensino superior,some college,,,,
cv51928.xml,virtual fundação bradesco - concluído - 03/2018  com carga horária de 20 horas.,,,,2018-03,notknown,,,,,2018-03,,,,true,deg-7,,,,,,virtual fundação bradesco
cv51928.xml,pacote office e digitação - concluído- centro de assistência social casa azul felipe augusto -concluído- 08/2015,,,,2015-08,notknown,,,,,2015-08,,,,true,deg-5,,,,,,centro de assistência social casa azul
cv51928.xml,curso de inglês intermediário - cursando - centro interescolar de línguas de brasília - cil 01,,,2001,,notknown,,,,,,,,,false,deg-2,,,,,,centro interescolar de línguas de brasília
cv51928.xml,cursando - segundo ano do ensino médio - centro de ensino médio elefante branco (cemeb)  cursos e treinamento,,,,,,,,,,,,,ensino médio,false,deg-1,ensino médio,some high school or equivalent,,,,centro de ensino médio elefante
cv51928.xml,curso  de  auxiliar  administrativo - centro  profissional  de  educação  a distância ceped - cursando- com carga horária de 50 horas.,,,,,,,,,,,,,,false,deg-3,,,,,,centro  profissional  de  educação  a distância ceped
cv51928.xml,curso de auxiliar veterinário - cursando- centro profissional de educação a distância ceped - cursando- com carga horária de 50 horas.,,,,,,,,,,,,,,false,deg-4,,,,,,centro profissional de educação a distância ceped
cv51928.xml,curso  de  atendimento  ao  público - centro  de  educação á distância escola,,,,,,,,,,,,,,,deg-6,,high school or equivalent,,,,centro  de  educação á distância escola
cv35152.xml,pós-graduação: gestão de projetos de engenharia de software universidade estácio de sá  - 2005,,,2005,,notknown,,,,2005,,gestão de projetos,,pós-graduação,,deg-2,masters,masters,,,,universidade estácio de sá
cv35152.xml,graduação: bacharelado em ciência da computação ucb  universidade católica de brasília- 2000,,,2000,,notknown,,,,2000,,,,graduação,,deg-1,bachelors,bachelors,,,,ucb  universidade católica de brasília
cv35152.xml,mestrado gestão de conhecimento e ti - ucb - trancado ucb  universidade católica de brasília,,,,,,,,,,,gestão de conhecimento e ti,,mestrado,,deg-3,mestrado,masters,,,,ucb  universidade católica de brasília
cv52634.xml,instituição: uniceub - centro universitário de brasília curso: psicologia semestre: 9° semestre período: noturno,,,,,,,,,,,psicologia,,,,deg-1,,,,,,uniceub - centro universitário de brasília
cv49131.xml,• mba: gerenciamento de projeto com enfase no pmi • fiap • 2018,,,2018,,notknown,,,,,,,,mba,false,deg-2,mba,mba,,,,fiap
cv49131.xml,• graduação: bacharelado em sistemas de informação • umc • 2014,,,2014,,notknown,,,,2014,,,,graduação,,deg-1,bachelors,bachelors,,,,umc
cv54561.xml,july 2012 - atual bacharel em ciências da indra company   brasília - df computação na ufsc - período:,,current,,,,,2012-07,,,,,,bacharel,false,deg-1,bachelors,bachelors,br,brasília,df,ufsc
cv54561.xml,bacharel em filosofia na ufsc - pelo suporte e apoio a equipe de período: 1998 a 2000 - parcial (2 desenvolvimento de diversos,,,2000,,,1998,,,2000,,filosofia,,bacharel em filosofia,,deg-2,bachelors,bachelors,,,,ufsc
cv54561.xml,anos) sistemas no setor de cartão de bacharel em física na ufsc - crédito da caixa econômica federal. período: 1989 a 1990 - parcial (1½ atribuições: projeto de arquitetura de anos) sistemas  monitorar e guiar equipe de desenvolvimento da baixa,,,1990,,,1989,,,1990,,projeto de arquitetura,,bacharel em física,,deg-3,bachelors,bachelors,,,,ufsc
cv48549.xml,bacharel em sistemas de informação (formado em 2005) unifeo (centro universitário fieo),,,2005,,notknown,,,,2005,,formado,,bacharel em sistemas de informação,,deg-1,bachelors,bachelors,,,,centro universitário fieo
cv48549.xml,tecnólogo em processamento de dados (formado em 2000) fito (fundação instituto tecnológico de osasco),,,2000,,notknown,,,,2000,,,,,,deg-2,,,,,,fundação instituto tecnológico de osasco
cv44526.xml,•  técnico em informática  escola técnica de brasília - 03/2013 a 12/2015.,,,,2015-12,,,2013-03,,,2015-12,,,,,deg-2,,high school or equivalent,,,,escola técnica de brasília
cv44526.xml,•  graduação em analise e desenvolvimento de sistemas  centro universitário do distrito federal 2º semestre (cursando),,,,,,,,,,,analise e desenvolvimento de sistemas,,graduação em analise e desenvolvimento de sistemas,false,deg-1,bachelors,bachelors,,,,centro universitário do distrito federal
cv48400.xml,pós-graduação - especialização tecnologias para aplicações web  faculdade anhanguera. (janeiro de 2019) - cursando,,,,2019-01,notknown,,,,,,tecnologias para aplicações web,,pós-graduação,false,deg-1,masters,masters,,,,faculdade anhanguera
cv48400.xml,- graduação sistemas de informação  faculdade projeção. (dezembro de 2017) - concluído,,,,2017-12,notknown,,,,,2017-12,sistemas de informação,,graduação,true,deg-2,bachelors,bachelors,,,,faculdade projeção
cv42896.xml,pós-graduada em psicologia organizacional instituição: w pós concluído em out/2015  nível superior completo: gestão de recursos humanos,,,,2015-10,notknown,,,,,2015-10,pós-graduada,,,true,deg-1,,,,,,w pós
cv42896.xml,instituição: centro universitário unieuro. concluído em dez/2010.,,,,2010-12,notknown,,,,,2010-12,,,,true,deg-2,,,,,,centro universitário unieuro
